https://www.co.wadena.mn.us/214/Passport-Acceptance-Facility,text/html; charset=utf-8,200,Indexable,"Passport Acceptance Facility | Wadena County, MN - Official Website",67,607,Access contact information for the Passport Acceptance Facility.,64,404,Passport Acceptance Facility,28,GUIDELINES,10,322,93.0,146003,34859,322,93.0,3.462,1.25,188,157,0,22,20,0,7.526,2,2,2,3,2,3
https://www.coaaa.org/cms/services/need-help-staying-at-home/passport,text/html; charset=utf-8,200,Indexable,PASSPORT,8,101,COAAA,5,47,Are You Ready to Fly?,21,College of Agriculture and Life Sciences,40,343,75.0,32569,8910,343,75.0,4.573,1.25,86,72,0,7,7,0,2.112,2,2,1,2,1,3
https://a0333-passportpublic.nyc.gov/,text/html,200,Indexable,PASSPort Public,15,147,"UF/IFAS Extension bring the power of UF’s research and education to every county in Florida. We support farmers and growers, home and business owners, youth and families through science-based programs, information and accessible expertise.",239,0,Undergraduate Degrees,21,Advanced Object Oriented Programming (4340701),46,1273,211.0,37353,8923,1273,211.0,6.033,1.25,22,20,0,1,1,0,1.023,2,2,3,1,2,3
https://ru.usembassy.gov/u-s-citizen-services/passports/photos/,text/html,200,Indexable,Technical Difficulties,22,186,"Are you learning calligraphy, a hand lettering beginner, but don't know where to start? This faux calligraphy or fauxligraphy basics tutorial is for you!",153,0,Our Mission,11,"Civil, Architectural and Environmental Engineering",50,19,4.0,188871,188871,19,4.0,4.75,0.0,0,0,0,0,0,0,1.302,2,2,3,1,2,3
https://www.doi.gov/intl/oia-passport-and-visa-division,text/html; charset=UTF-8,200,Indexable,OIA Passport and Visa Division | U.S. Department of the Interior,64,555,"The Passport and Visa Division of the DOI Office of International Affairs (INT) assists DOI employees (except Bureau of Reclamation and USGS employees) in obtaining the official passports and visas required to undertake official international travel for the Department of the Interior.Additionally, in conformance with Department of State policy and guidance, the INT Passport and",380,2340,OIA Passport and Visa Division,30,Ask for info,12,1098,174.0,66293,12528,1098,174.0,6.31,1.25,67,54,0,41,27,0,2.422,2,2,3,4,2,3
https://github.com/jaredhanson/passport,text/html; charset=utf-8,200,Indexable,"GitHub - jaredhanson/passport: Simple, unobtrusive authentication for Node.js.",78,696,"Simple, unobtrusive authentication for Node.js. Contribute to jaredhanson/passport development by creating an account on GitHub.",128,817,"Search code, repositories, users, issues, pull requests...",58,Provide feedback,16,1293,338.0,420981,67528,1293,338.0,3.825,2.5,211,131,0,31,26,0,0.82,2,2,3,3,2,3
https://www.psrc.org/our-work/passport-2044-comprehensive-plan-workshop-series,text/html; charset=UTF-8,200,Indexable,Passport to 2044: Comprehensive Plan Workshop Series | Puget Sound Regional Council,83,781,"The Puget Sound Regional Council hosted fifteen online workshops to support the comprehensive periodic plan updates. These events were produced in collaboration with the Washington State Department of Commerce, the Municipal Research and Services Center (MRSC), and many other partners across the state.",303,1958,Passport to 2044: Comprehensive Plan Workshop Series,52,Bachelor of Science in Mathematics,34,313,69.0,79650,11746,313,69.0,4.536,1.25,192,77,0,13,8,0,4.318,2,2,3,4,2,3
https://es.usembassy.gov/adult-passport-renewal/,text/html,200,Indexable,Technical Difficulties,22,186,Discover the Wooden Chair by Marc Newson crafted by Cappellini. Shop the exclusive selection of Lounge Chairs on Artemest online store.,135,0,Introducing Gen-3 Alpha.,24,Naive implemantation of the backward pass through the BatchNorm-Layer,69,19,4.0,188871,188871,19,4.0,4.75,0.0,0,0,0,0,0,0,1.422,2,2,3,1,2,3
https://disneyland.disney.go.com/passes/,text/html; charset=utf-8,200,Indexable,Magic Key Passes | Disneyland Resort,36,334,"Get your Disneyland Magic Key pass now to unlock exclusive reservation-based admission opportunities, discounts, and experiences tailored just for you!",151,948,Annual Passports*,17,Magic Key Passes,16,3228,420.0,104869,25278,3228,420.0,7.686,1.25,44,18,0,0,0,0,2.669,2,2,3,3,2,3
https://eforms.state.gov/Forms/ds11_pdf.PDF,application/pdf,200,Indexable,Home - College of Agriculture & Life Sciences,45,0,"Explore a Mathematics & Computer Science, Bachelor of Science in Liberal Arts and Sciences (BSLAS) degree at the nation's #5 best computer science program at the University of Illinois Urbana-Champaign.",202,0,Christmas Song Lyrics,21,99 Bottles of OOP - 2nd Edition,31,0,,1890693,1890693,0,,,1.25,0,0,0,0,0,0,3.54,2,2,3,1,2,1
https://www.passportparking.com/,text/html; charset=UTF-8,200,Indexable,Passport Parking App - Park. Pay. Be on Your Way. ©,51,465,"What does the next revolution in parking look like? The Passport Parking app. Pay, extend and manage your parking session from your mobile phone. It's easy!",156,979,Calligraphy in Islamic Art,26,Subscribe to RSS,16,383,89.0,40741,9169,383,89.0,4.303,2.5,17,6,0,13,7,0,1.35,2,2,3,3,2,3
https://en.chateauversailles.fr/plan-your-visit/tickets-and-prices,text/html; charset=utf-8,200,Indexable,Tickets and prices | Palace of Versailles,41,348,Book online on the official ticketing website. Save time and book your access to the palace with a time slot.,109,663,Tickets and prices,18,Subscribe to RSS,16,3343,570.0,197452,33706,3343,570.0,5.865,1.25,324,119,0,19,14,0,4.731,2,2,3,3,2,3
https://www.jupiter.fl.us/1951/Passport-to-Jupiter,text/html; charset=utf-8,200,Indexable,"Passport to Jupiter | Jupiter, FL - Official Website",52,431,"Superette's jewellery collection caters to all tastes, featuring gold and silver pendant and charm necklaces, a wide range of earrings, and an assortment of bracelets and rings. Free shipping on orders over $100.",212,0,Passport to Jupiter,19,Florida Municipal Achievement Awards Winner image,49,310,66.0,129881,32588,310,66.0,4.697,1.25,140,105,0,17,10,0,28.312,2,2,3,1,2,3
https://www.uscis.gov/i-9-central/form-i-9-acceptable-documents,text/html; charset=UTF-8,200,Indexable,Form I-9 Acceptable Documents | USCIS,37,355,Employees must provide documentation to their employers to show their identity and authorization to work.,105,666,Form I-9 Acceptable Documents,29,Mizzou Engineering,18,1911,324.0,133191,22262,1911,324.0,5.898,1.25,189,159,0,15,12,0,1.314,2,2,3,3,2,3
https://www.cbp.gov/travel/us-citizens/mobile-passport-control,text/html; charset=UTF-8,200,Indexable,Mobile Passport Control (MPC) | U.S. Customs and Border Protection,66,609,"New to abstract painting with acrylics? Discover the power of acrylic 
mediums for creating dimension, depth, and adding transparency to your 
vibrant artworks. Explore the advantages of acrylic mediums and how they 
can improve your techniques. Experiencing with mediums is a perfect way for 
artists seeking to enhance their skills and craft.",348,0,Mobile Passport Control (MPC),29,College of Agriculture and Life Sciences,40,1487,269.0,125479,20081,1487,269.0,5.528,1.25,238,183,0,15,14,0,1.309,2,2,3,1,2,3
https://www.passportjs.org/,text/html; charset=UTF-8,200,Indexable,Passport.js,11,99,"Simple, unobtrusive authentication for Node.js",46,287,Undergraduate Degrees,21,Subscribe to RSS,16,65,19.0,8320,8320,65,19.0,3.421,1.25,11,8,0,5,5,0,2.619,2,2,2,3,2,2
https://uy.usembassy.gov/passports/,text/html,200,Indexable,Technical Difficulties,22,186,"Loaded with veggies, crunchy cashews, warm spices like saffron, herbs like cilantro and mint, this Vegetable Biryani is a delight to the taste buds!",148,0,Parenting: 14 Gospel Principles That Can Radically Change Your Family,69,Get the best deal of the year. Over 50% off.,44,19,4.0,188871,188871,19,4.0,4.75,0.0,0,0,0,0,0,0,3.134,2,2,3,1,2,3
https://www.tulare.ca.gov/government/departments/community-services/tulare-public-library/services/passports,text/html; charset=utf-8,200,Indexable,Get a Passport | City of Tulare,31,261,"New to abstract painting with acrylics? Discover the power of acrylic 
mediums for creating dimension, depth, and adding transparency to your 
vibrant artworks. Explore the advantages of acrylic mediums and how they 
can improve your techniques. Experiencing with mediums is a perfect way for 
artists seeking to enhance their skills and craft.",348,0,City of Tulare,14,Stay in touch!,14,1082,267.0,131435,26796,1082,267.0,4.052,1.25,191,165,0,1,1,0,5.215,2,2,3,1,2,3
https://id.usembassy.gov/passports/,text/html,200,Indexable,Technical Difficulties,22,186,"Books shelved as sad-poetry: The Sun and Her Flowers by Rupi Kaur, You'll Come Back to Yourself by Michaela Angemeer, Ariel by Sylvia Plath, sad thing an...",156,0,Statistics > Machine Learning,29,Meet Mario Ferruzzi CALS New Dean,33,19,4.0,188871,188871,19,4.0,4.75,0.0,0,0,0,0,0,0,2.359,2,2,3,1,2,3
https://www.tsa.gov/travel/security-screening/identification,text/html; charset=UTF-8,200,Indexable,Acceptable Identification at the TSA Checkpoint | Transportation Security Administration,88,783,Adult passengers 18 and older must show valid identification at the airport checkpoint in order to travel.,106,643,Acceptable Identification at the TSA Checkpoint,47,Subscribe to RSS,16,619,102.0,59732,12828,619,102.0,6.069,2.5,121,55,0,20,16,0,1.306,2,2,3,3,2,3
https://www.usps.com/international/passports.htm,text/html,200,Indexable,Passport Application & Passport Renewal | USPS,46,429,Learn how to apply for or renew a passport and make an appointment. You can rely on USPS for information about the passport application & passport renewal process.,163,1039,Passports,9,Subscribe to RSS,16,2248,410.0,133370,28740,2248,410.0,5.483,1.25,212,126,0,41,29,0,1.664,1,2,3,4,2,3
https://www.dubuquecountyiowa.gov/249/Passport-Applications,text/html; charset=utf-8,200,Indexable,"Passport Applications | Dubuque County, IA",42,385,Learn about the items needed to obtain a passport.,50,317,Passport Applications,21,Get the best deal of the year. Over 50% off.,44,245,91.0,88747,25444,245,91.0,2.692,1.25,38,28,0,13,11,0,1.808,2,2,2,3,2,3
https://wildlife.ca.gov/Fishing/Passport,text/html; charset=utf-8,200,Indexable,California Fishing Passport,27,238,"The Department of Fish and Wildlife manages California's diverse fish, wildlife, and plant resources, and the habitats upon which they depend, for their ecological values and for their use and enjoyment by the public.",217,1324,California Fishing Passport,27,Need help?,10,791,157.0,44509,44509,791,157.0,5.038,1.25,113,78,0,5,5,0,30.561,2,2,3,4,2,3
https://passportshipping.com/,text/html; charset=UTF-8,200,Indexable,Home - Passport Shipping,24,230,Discover the Wooden Chair by Marc Newson crafted by Cappellini. Shop the exclusive selection of Lounge Chairs on Artemest online store.,135,0,Your Passport to international growth,37,ECE 205 Object Oriented Programming (4),39,942,182.0,283816,43263,942,182.0,5.176,1.25,86,38,0,4,2,0,1.452,2,2,3,1,2,3
https://parks.nv.gov/passport,text/html; charset=UTF-8,200,Indexable,Take the Nevada State Parks Passport Challenge! | State Parks,61,553,"Take the Passport Challenge! The Passport Program was designed to challenge and encourage Nevada residents and visitors to experience the diverse natural, cultural and recreational resources that span all of Nevada's state parks.",229,1435,Passport,8,Subscribe to RSS,16,732,107.0,33911,6667,732,107.0,6.841,1.25,200,159,0,9,5,0,3.99,1,2,3,4,2,3
https://www.usa.gov/passport,text/html,200,Indexable,U.S. passports | USAGov,23,215,Find out how to apply for or renew a passport for an adult or a minor under 18. Know what to do if a passport is lost or stolen.,128,775,Welcome to USA.gov,18,U.S. passports,14,266,54.0,42593,9961,266,54.0,4.926,1.25,51,31,0,10,10,0,5.67,2,2,3,3,2,3
https://odus.princeton.edu/student-engagement/odus-arts/passport-arts,text/html; charset=UTF-8,200,Indexable,Passport to the Performing Arts | The Office of the Dean of Undergraduate Students,82,737,It's so comfy and we love the POCKETS! It's our all-time favorite sweatshirt!,77,0,The Office of the Dean of Undergraduate Students,48,Passport to the Performing Arts,31,352,56.0,63528,10086,352,56.0,6.286,1.25,111,95,0,4,4,0,1.46,2,2,2,1,2,3
https://www.canada.ca/en/immigration-refugees-citizenship/services/canadian-passports.html,text/html;charset=utf-8,200,Indexable,Canadian passports and other travel documents: Applying in Canada - Canada.ca,77,715,"Learn how to apply for a Canadian passport or other travel documents, find forms, get passport services, report a lost or stolen passport, get urgent passport services and more.",177,1089,Canadian passports and other travel documents: Applying in Canada,65,Mizzou Engineering,18,613,97.0,40252,11866,613,97.0,6.32,1.25,77,60,0,10,9,0,3.596,2,2,3,4,2,3
https://www.michigan.gov/dnr/buy-and-apply/rec-pp,text/html; charset=utf-8,200,Indexable,Recreation Passport,19,179,"The Recreation Passport is required for motorized vehicle access to state parks and recreation areas and state-managed boating access sites, state forest campgrounds, thousands of miles of trails and other outdoor spaces.",221,1386,Recreation Passport,19,Recreation Passport,19,4106,940.0,438580,38238,4106,940.0,4.368,1.25,679,250,0,28,19,0,4.255,2,2,3,4,2,3
https://www.co.kendall.tx.us/182/Passport,text/html; charset=utf-8,200,Indexable,"Passport | Kendall County, TX",29,261,Learn more about the Passport on this page.,43,276,Passport,8,College of Agriculture and Life Sciences,40,659,128.0,92456,26937,659,128.0,5.148,1.25,51,45,0,8,5,0,4.245,1,2,2,3,2,3
https://shop.sandisk.com/products/ssd/portable-ssd/wd-my-passport-usb-3-2-ssd,text/html; charset=UTF-8,200,Indexable,500GB Blue My Passport SSD | SanDisk,36,347,"Save, access and protect your content with My Passport SSD, giving you read speeds of up to 1050MB/s and write speeds of up to 1000MB/s2 with NVMe technology. Now compatible with iPhone 15 Plus/Pro/Max smartphones. Free up space fast and easy.",243,1593,Model Number: {{currentSku}} My Passport SSD - {{getUnEscapedHTMLContent(variantTagData)}},90,My Passport SSD,15,18546,10905.0,3987572,381301,18546,10905.0,1.701,1.25,230,120,0,74,26,0,2.642,2,2,3,4,2,3
https://americasnationalparks.org/passport-to-your-national-parks/,text/html; charset=UTF-8,200,Indexable,Passport To Your National Parks - America's National Parks,58,522,"By Alexander Petkov Have you noticed how the same cliche questions always get asked at job interviews — over and over again? I’m sure you know what I mean. For example: Where do you see yourself in five years? or, even worse: What do you consider ...",250,0,Passport To Your National Parks,31,Working with Normalization Rules,32,525,93.0,232701,49014,525,93.0,5.645,1.25,36,25,0,5,5,0,9.044,2,2,3,1,2,3
https://www.state.gov/x-gender-marker-available-on-u-s-passports-starting-april-11/,text/html,200,Indexable,Technical Difficulties,22,186,"Superette's jewellery collection caters to all tastes, featuring gold and silver pendant and charm necklaces, a wide range of earrings, and an assortment of bracelets and rings. Free shipping on orders over $100.",212,0,Are You Ready to Fly?,21,Get the best deal of the year. Over 50% off.,44,19,4.0,188871,188871,19,4.0,4.75,0.0,0,0,0,0,0,0,1.495,2,2,3,1,2,3
https://www.wolterskluwer.com/en/solutions/enterprise-legal-management/passport,text/html; charset=utf-8,200,Indexable,Legal Spend and Matter Management | Passport Software | Wolters Kluwer,70,659,"Our legal and spend management software, Passport, helps streamline workflows & reduce legal spend for corporate legal & insurance claims teams.",144,921,Passport | Legal Spend and Matter Management,44,Working with Normalization Rules,32,985,229.0,177053,22989,985,229.0,4.301,1.25,199,150,0,9,9,0,2.309,2,2,3,3,2,3
https://www.astc.org/membership/find-an-astc-member/passport/,text/html; charset=UTF-8,200,Indexable,ASTC Passport Program - Association of Science and Technology Centers,69,654,"Are you learning calligraphy, a hand lettering beginner, but don't know where to start? This faux calligraphy or fauxligraphy basics tutorial is for you!",153,0,ASTC Passport Program,21,See why the Hyundai PALISADE is better than the Honda Pilot ⁠ Claim based on comparison of specifications on manufacturer websites.,131,590,93.0,258385,45797,590,93.0,6.344,1.25,233,94,0,9,8,0,1.619,2,3,3,1,2,3
https://www.sandiegocounty.gov/content/sdc/cob/passport.html,text/html;charset=utf-8,200,Indexable,Apply for a passport,20,177,Learn how to apply for a U.S. passport or passport card through the County of San Diego. Make an appointment. See fees and application process.,143,906,Apply for a passport,20,99 Bottles of OOP - 2nd Edition,31,2028,457.0,70526,14429,2028,457.0,4.438,1.25,230,171,0,52,44,0,2.549,2,2,3,3,2,3
https://uk.usembassy.gov/u-s-citizen-services/u-s-passports/,text/html,200,Indexable,Technical Difficulties,22,186,"Are you learning calligraphy, a hand lettering beginner, but don't know where to start? This faux calligraphy or fauxligraphy basics tutorial is for you!",153,0,Are you ready for the skydiving thrill of a lifetime? Freefall with the best at Skydive Spaceland!,98,InkscapeForum.com,17,19,4.0,188871,188871,19,4.0,4.75,0.0,0,0,0,0,0,0,4.885,2,2,3,1,2,3
https://nl.usembassy.gov/passports/,text/html,200,Indexable,Technical Difficulties,22,186,Transform your old rocking chairs into stylish masterpieces with this DIY project. Renewed rush seat chairs using recycled belts for a unique touch. Perfect for adding a touch of Turkey decor to your home.,205,0,Undergraduate Degrees,21,Subscribe to RSS,16,19,4.0,188871,188871,19,4.0,4.75,0.0,0,0,0,0,0,0,3.16,2,2,3,1,2,3
https://theforkedspoon.com/biryani-recipe/,text/html; charset=UTF-8,200,Indexable,Biryani Recipe - How to Make Chicken and Lamb Biryani - The Forked Spoon,72,667,"Biryani is a mixed rice dish popular throughout the Indian subcontinent. It is made with long-grain basmati rice, meat, and aromatic spices including cinnamon, cloves, cumin, and saffron. Learn how to make this delicious chicken and lamb biryani recipe.",253,1559,Biryani Recipe – How to Make Chicken and Lamb Biryani,53,Get the best deal of the year. Over 50% off.,44,4109,628.0,556664,93975,4109,628.0,6.543,1.22,85,36,0,26,20,0,0.866,2,2,3,4,2,3
https://www.yummytummyaarthi.com/pressure-cooker-chicken-biryani-one-pot/,text/html; charset=UTF-8,200,Indexable,Pressure Cooker Chicken Biryani Recipe,38,353,Pressure Cooker Chicken Biryani Recipe with step by step pictures. This is made with Basmati Rice and whole garam spices,120,766,Pressure Cooker Chicken Biryani Recipe,38,Naive implemantation of the backward pass through the BatchNorm-Layer,69,4523,1044.0,487262,80450,4523,1044.0,4.332,1.22,184,51,0,46,23,0,2.272,2,2,3,3,2,3
https://www.theguardian.com/food/article/2024/aug/31/yotam-ottolenghi-comforting-rice-recipes-blackberry-rice-pudding-and-soy-chicken-biryani,text/html; charset=UTF-8,200,Indexable,Crisp soy chicken biryani and blackberry rice pudding: Yotam Ottolenghi’s comforting rice recipes | Rice | The Guardian,119,1041,"Cantonese soy chicken but cooked in a crusty-topped baked rice, and a crackly-topped cinnamon and lemon rice pudding with blackberries",134,860,Crisp soy chicken biryani and blackberry rice pudding: Yotam Ottolenghi’s comforting rice recipes,97,Mathematics,11,1294,204.0,324055,54786,1294,204.0,6.343,1.22,146,97,0,11,9,0,1.372,2,2,3,3,3,4
https://www.nhs.uk/start-for-life/baby/recipes-and-meal-ideas/veggie-biryani/,text/html; charset=utf-8,200,Indexable,Veggie biryani - Weaning recipes - Start for Life - NHS,55,465,"A super easy but interesting one-pot meal using mixed vegetables, chickpeas, rice and curry powder.",99,621,Veggie biryani recipe,21,Mathematics,11,300,62.0,41879,12753,300,62.0,4.839,1.22,21,18,0,0,0,0,1.108,2,2,2,3,2,3
https://donalskehan.com/recipes/easy-chicken-biryani/,text/html; charset=UTF-8,200,Indexable,Easy Chicken Biryani - Donal Skehan | EAT LIVE GO,49,447,"My quick version of this Indian classic results in perfectly cooked rice and moist chicken - just as it should be. As if that wasn't enough, you only need to use one pan so there's minimal washing up!",200,1215,Easy Chicken Biryani,20,Stay in touch!,14,629,128.0,52344,12546,629,128.0,4.914,1.22,36,18,0,16,4,0,1.809,2,2,3,4,2,3
https://www.greatbritishchefs.com/recipes/chicken-biryani-recipe,text/html; charset=utf-8,200,Indexable,Ammu’s Chicken Biryani Recipe - Great British Chefs,51,460,This chicken biryani recipe is a celebratory dish very special to chef Asma Khan. A great dish for a special occasion.,118,715,Ammu’s chicken biryani,22,Working with Normalization Rules,32,2235,482.0,551892,81044,2235,482.0,4.637,0.0,347,169,0,13,7,0,0.49,2,2,3,3,2,3
https://www.chilipeppermadness.com/recipes/biryani/,text/html; charset=UTF-8,200,Indexable,Chicken Biryani Recipe - Chili Pepper Madness,45,409,"This homemade biryani is layered with tender chicken, fluffy rice, and fragrant spices all in one pot, a delicious, comforting dish the family will love.",153,903,Chicken Biryani Recipe,22,Mizzou Engineering,18,1989,378.0,346786,66409,1989,378.0,5.262,1.22,98,58,0,27,21,0,1.064,2,2,3,3,2,3
https://recipes.timesofindia.com/recipes/chicken-biryani/rs53096628.cms,text/html;charset=UTF-8,200,Indexable,Chicken Biryani Recipe: How to make Chicken Biryani Recipe at Home | Easy Chicken Biryani Recipe - Times Food,109,994,"Easy Chicken Biryani Recipe: Make the easy and delicious chicken biryani recipe at home using ingredients like chicken, basmati rice, garam masala powder, clove, ginger paste and more on Times Food",197,1242,Chicken Biryani Recipe,22,Title:FateZero: Fusing Attentions for Zero-shot Text-based Video Editing,72,2620,566.0,255580,48449,2620,566.0,4.629,1.22,272,209,0,13,11,0,1.147,2,2,3,4,3,3
https://www.teaforturmeric.com/chicken-biryani/,text/html; charset=UTF-8,200,Indexable,Pakistani Chicken Biryani Recipe (The BEST!) - Tea for Turmeric,63,559,"An authentic Chicken Biryani recipe with simple, easy-to-follow instructions and mouthwatering, traditional Pakistani and Indian flavor.",136,831,Pakistani Chicken Biryani Recipe (The BEST!),44,Meet Mario Ferruzzi CALS New Dean,33,5186,838.0,480573,83309,5186,838.0,6.189,1.22,206,72,0,22,12,0,0.855,2,2,3,3,2,3
https://www.woolworths.co.nz/recipes/dinner/3040/lamb-biryani,text/html; charset=utf-8,200,Non-Indexable,Elegant men's leather wallets | The Bridge,42,0,"Shop for groceries online and get fresh, free recipes at woolworths.co.nz, formerly countdown.co.nz.",100,623,Our Mission,11,Trending Songs,14,0,,26165,8197,0,,,0.0,0,0,0,0,0,0,1.425,2,2,3,3,2,1
https://cardozlegacy.com/floyds-friends-recipes/kashmiri-chicken-biryan,text/html;charset=utf-8,200,Indexable,Kashmiri Chicken Biryani Recipe with Floyd Cardoz Masalas — Cardoz Legacy,73,682,"This fragrant, flavor-forward chicken biryani recipe with Floyd Cardoz's 
signature kashmiri and garam masalas comes from former Paowalla sous chef, 
Phil Marokus. Try this easy, comforting chicken dinner any night of the 
week.",231,1408,Kashmiri Chicken Biryani,24,InkscapeForum.com,17,584,104.0,119942,20974,584,104.0,5.615,1.22,93,34,0,10,6,0,1.293,2,2,3,4,2,3
https://www.bbcgoodfood.com/recipes/chicken-biryani,text/html; charset=utf-8,200,Indexable,Chicken biryani recipe | Good Food,34,306,Not sure what to make for dinner? This chicken biryani recipe is easy and delicious. Find more dinner inspiration at BBC Good Food.,131,815,Chicken biryani,15,Updated US and Canadian Normalization Factors for TRACI 2.1,59,534,118.0,425210,78060,534,118.0,4.525,1.22,138,109,0,35,27,0,0.662,2,2,3,3,2,3
https://www.food.com/recipe/the-best-biryani-177830,text/html;charset=UTF-8,200,Indexable,The Best Biryani Recipe  - Food.com,35,313,"When I make this recipe, I take out so many spices but it is well worth it.  My family and friends can't get enough.",116,692,The Best Biryani,16,InkscapeForum.com,17,1068,231.0,523833,71954,1068,231.0,4.623,1.22,161,136,0,22,19,0,3.416,2,2,3,3,2,3
https://www.lionbrand.com.au/recipes/thai-style-chicken-biryani-recipe-khao-mok-kai/,text/html; charset=UTF-8,200,Non-Indexable,Thai Style Chicken Biryani Recipe (Khao Mok Kai) - Lion Brand,61,543,"I have this maple rocker, having sat in front of the stove for a month or so it has dried out and a back leg joint loosened up. It is not a terribly old rocker 60’s-80’s vintage, so presumably not hide glue. I don't want to use gorilla glue because it foams and expands, i am contemplating epoxy w...",300,0,Thai Style Chicken Biryani Recipe (Khao Mok Kai),48,Mathematics,11,774,130.0,126702,25250,774,130.0,5.954,1.22,31,14,0,12,12,0,1.993,2,2,3,1,2,3
https://mission1.org/sharing-our-partners-biryani-recipe/,text/html; charset=UTF-8,200,Indexable,Sharing A Special Biryani Recipe from our Partner in India - Mission ONE,72,632,"At Mission ONE, we believe that partnerships go beyond just business—they’re about building relationships. One very memorable moment occurred when our President, Olivia Mulerwa, had the pleasure of hosting our partner from India, Malini, in her home.",250,1571,Sharing A Special Biryani Recipe from our Partner in India,58,Working with Normalization Rules,32,881,122.0,94567,21676,881,122.0,7.221,1.22,50,41,0,7,6,0,1.841,2,2,3,4,2,3
https://holycowvegan.net/vegetable-biryani/,text/html; charset=UTF-8,200,Indexable,Vegetable Biryani (How to Make Veg Biryani) - Holy Cow Vegan,60,553,This restaurant-style vegetable biryani has layers of aromatic basmati rice and a spicy masala sauce. It's the best Indian comfort food!,136,827,Vegetable Biryani (How to Make Veg Biryani),43,Advanced Object Oriented Programming (4340701),46,4226,729.0,534319,98811,4226,729.0,5.797,1.22,154,63,0,27,20,0,1.046,2,2,3,3,2,3
