https://catalog.umkc.edu/colleges-schools/science-engineering/civil-engineering/bachelor-of-science-civil-engineering/,text/html; charset=UTF-8,200,Indexable,Bachelor of Science: Civil Engineering < University of Missouri-Kansas City,75,652,"Are you learning calligraphy, a hand lettering beginner, but don't know where to start? This faux calligraphy or fauxligraphy basics tutorial is for you!",153,0,University of Missouri-Kansas City,34,Bachelor of Science: Civil Engineering,38,2602,471.0,254590,254590,2602,471.0,5.524,1.08,1088,1017,0,10,10,0,4.383,2,2,3,1,2,3
https://www.britannica.com/technology/civil-engineering,text/html;charset=UTF-8,200,Indexable,"Civil engineering | Definition, History, Functions, Branches, & Facts | Britannica",82,687,"Civil engineering, the profession of designing and executing structural works that serve the general public, such as dams, bridges, aqueducts, canals, highways, power plants, sewerage systems, and other infractructure. Learn more about civil engineering with this article.",272,1667,civil engineering,17,Working with Normalization Rules,32,1608,308.0,97074,22329,1608,308.0,5.221,1.08,176,128,0,15,15,0,0.845,2,2,3,4,2,3
https://www.calstatela.edu/ecst/ce,text/html; charset=UTF-8,200,Indexable,Department of Civil Engineering | Cal State LA,46,403,"By Alexander Petkov Have you noticed how the same cliche questions always get asked at job interviews — over and over again? I’m sure you know what I mean. For example: Where do you see yourself in five years? or, even worse: What do you consider ...",250,0,Department of Civil Engineering,31,Choose a Location,17,609,142.0,59734,11694,609,142.0,4.289,1.08,134,94,0,19,10,0,1.528,2,2,3,1,2,3
https://www.missouristate.edu/EGR/Civil/default.htm,text/html,200,Indexable,Civil Engineering Undergraduate Program - Cooperative Engineering Program - College of Natural and Applied Sciences - Missouri State,132,1189,Build your community as a civil engineer. Earn your degree from Missouri S&T; take classes at MSU.,98,615,Civil Engineering Undergraduate Program,39,Mathematics,11,439,82.0,65587,20495,439,82.0,5.354,1.08,132,109,0,21,21,0,1.17,2,2,2,3,3,4
https://engineering.rowan.edu/programs/civilenvironmental/,text/html; charset=UTF-8,200,Indexable,Civil & Environmental Engineering,33,297,Rowan University is a Carnegie-classified national doctoral research institution dedicated to excellence in undergraduate and graduate education.,145,899,Civil & Environmental Engineering,33,Civil & Environmental Engineering,33,637,149.0,53642,53642,637,149.0,4.275,1.08,118,106,0,12,11,0,3.439,2,2,3,3,2,3
https://erau.edu/degrees/bachelor/civil-engineering,text/html; charset=utf-8,200,Indexable,Bachelor's Degree in Civil Engineering,38,333,The Civil Engineering Bachelor's program at Embry-Riddle fosters sophisticated problem-solving and team-building skills to prepare you for a focused career and to pass the Fundamentals of Engineering exam.,205,1291,Bachelor of Science in Civil Engineering,40,Easy Boneless Chicken Biryani Recipe,36,2098,385.0,74754,74787,2098,385.0,5.449,1.08,131,81,0,14,8,0,2.842,2,2,3,4,2,3
https://www.civil.utah.edu/bs-civil-engineering/,text/html; charset=UTF-8,200,Indexable,BS Civil Engineering - Civil & Environmental Engineering,56,489,Civil & Environmental Engineering,33,208,Civil Engineering (BS),22,Trending Songs,14,1445,224.0,212115,31376,1445,224.0,6.451,1.08,128,94,0,7,7,0,1.694,2,2,2,3,2,3
https://madisoncollege.edu/academics/programs/civil-engineering-technology,text/html; charset=UTF-8,200,Indexable,Civil Engineering Technology Associate Degree | Madison College,63,579,Build the road for that journey of a thousand steps. Start here. Then go right to work – or transfer to get your bachelor’s.,124,741,Civil Engineering Technology,28,Trending Songs,14,2816,692.0,112037,23592,2816,692.0,4.069,1.08,202,173,0,19,18,0,2.205,2,2,3,3,2,3
https://www.jsums.edu/civilengineering/,text/html; charset=UTF-8,200,Indexable,arduino - microcontroller programming vs object oriented programming - Electrical Engineering Stack Exchange,108,0,"Organize your handbag with our iconic line of ""modern retro chic"" wallets. In noble and natural leather and vintage-inspired, they will be your daily accomplices.",162,0,Are you ready for the skydiving thrill of a lifetime? Freefall with the best at Skydive Spaceland!,98,2024–25 Ski Passport grades 3–6,31,0,,70254,70254,0,,,0.0,0,0,0,0,0,0,5.43,2,2,3,1,3,1
https://www.engineering.txst.edu/programs/civil.html,text/html; charset=utf-8,200,Indexable,"Civil Engineering (CE)
      : Ingram School of Engineering
      : Texas State University",90,675,"Organize your handbag with our iconic line of ""modern retro chic"" wallets. In noble and natural leather and vintage-inspired, they will be your daily accomplices.",162,0,Civil Engineering (CE),22,Need help?,10,554,108.0,63710,11082,554,108.0,5.13,1.08,55,36,0,24,20,0,13.183,2,2,3,1,2,3
https://wit.edu/academics/engineering/degrees/undergraduate/civil-engineering,text/html; charset=UTF-8,200,Indexable,Civil Engineering Undergraduate Degree in Boston | Wentworth,60,553,"Learn about the Civil Engineering Undergraduate Degree at Wentworth Institute of Technology, located right in the heart of downtown Boston, MA.",143,905,Civil Engineering,17,RAISING A CHILD WITH ANXIETY OR OCD?,36,1406,270.0,144258,28060,1406,270.0,5.207,1.08,490,343,0,17,16,0,3.924,2,2,3,3,2,3
https://cee.umd.edu/undergraduate/degrees/bachelor-science,text/html; charset=utf-8,200,Indexable,Bachelor of Science | Department of Civil & Environmental Engineering,69,621,"Loaded with veggies, crunchy cashews, warm spices like saffron, herbs like cilantro and mint, this Vegetable Biryani is a delight to the taste buds!",148,0,Bachelor of Science,19,Subscribe to RSS,16,458,95.0,36269,10269,458,95.0,4.821,1.08,111,81,0,10,9,0,6.767,2,2,3,1,2,3
https://www.bucknell.edu/academics/college-engineering/majors-departments/civil-environmental-engineering,text/html; charset=UTF-8,200,Indexable,Civil & Environmental Engineering Majors | Bucknell,51,453,"Bucknell's civil & environmental engineering degree programs offer small classes, hands-on labs and independent research opportunities. Learn more!",147,927,Civil & Environmental Engineering,33,Naive implemantation of the backward pass through the BatchNorm-Layer,69,926,173.0,176507,37817,926,173.0,5.353,1.08,160,85,0,19,9,0,1.062,2,2,3,3,2,3
https://cce.eng.ua.edu/,text/html; charset=UTF-8,200,Indexable,"Civil, Construction and Environmental Engineering",49,442,"Explore your math bachelor’s degree options at Northern Arizona University. Read about program details, campus availability, and apply today!",141,0,Statistics > Machine Learning,29,Meet Mario Ferruzzi CALS New Dean,33,478,98.0,40655,40655,478,98.0,4.878,1.08,89,81,0,0,0,0,2.301,2,2,3,1,2,3
https://admissions.uiowa.edu/academics/civil-engineering,text/html; charset=UTF-8,200,Indexable,Civil Engineering | Admissions - The University of Iowa,55,475,"Civil Engineering is about community service, development, and improvement. It involves the conception, planning, design, construction, and operation of facilities essential to modern life, from transit systems to offshore structures to space satellites.Civil engineers are solvers of real-world",295,1787,Admissions,10,Civil Engineering,17,890,156.0,82885,23357,890,156.0,5.705,1.08,59,49,0,5,5,0,1.35,2,2,3,4,2,3
https://engineering.tamu.edu/civil/academics/degrees/graduate/master-of-engineering.html,text/html,200,Indexable,Master of Engineering in Civil Engineering | Texas A&M University Engineering,77,684,How To Make Authentic Chicken Biryani At Home includes layers of rice and the meat gravy its seriously is the most aromatic smell.,130,0,Master of Engineering in Civil Engineering,42,ECE 205 Object Oriented Programming (4),39,310,67.0,55304,8201,310,67.0,4.627,1.08,89,67,0,14,14,0,2.91,2,2,3,1,2,3
https://cee.stanford.edu/academics-admission/undergraduate-degrees,text/html; charset=UTF-8,200,Indexable,Undergraduate Degrees | Civil and Environmental Engineering,59,542,"Los Angeles based modern calligrapher. Contact me for custom invitation 
design, calligraphy addressing, branding, artwork and all your calligraphy 
needs!",157,0,Undergraduate Degrees,21,GUIDELINES,10,652,99.0,57879,11476,652,99.0,6.586,1.08,89,67,0,9,9,0,1.53,2,2,3,1,2,3
https://ce.lafayette.edu/,text/html; charset=UTF-8,200,Indexable,Civil and Environmental Engineering · Lafayette College,55,487,A shrunken crew-neck sweatshirt in three views with chevron pieced colorblocking in sizes 0 - 30,96,0,Civil and Environmental Engineering,35,Meet Mario Ferruzzi CALS New Dean,33,266,67.0,181549,100512,266,67.0,3.97,1.08,97,76,0,12,10,0,2.536,2,2,2,1,2,3
https://www.cee.psu.edu/academics/what-is-civil-engineering.aspx,text/html; charset=utf-8,200,Indexable,What do civil engineers do? | Penn State Engineering,52,463,"Civil Engineers (CEs) are trained to solve the design, construction, and maintenance concerns of the natural and physically built environment. They deal with public works including highways, railroads, bridges, buildings, and water and energy systems.",251,1547,What do Civil Engineers do?,27,Updated US and Canadian Normalization Factors for TRACI 2.1,59,645,162.0,24792,24792,645,162.0,3.981,1.08,102,82,0,8,8,0,5.064,2,2,3,4,2,3
https://www.fau.edu/engineering/cege/graduate/ms/,text/html; charset=UTF-8,200,Indexable,Civil Program | Florida Atlantic University,43,358,Florida Atlantic University College of Engineering and Computer Science,71,446,MS with Major in Civil Engineering,34,Easy Boneless Chicken Biryani Recipe,36,325,71.0,34742,34742,325,71.0,4.577,1.08,111,94,0,6,6,0,1.925,2,2,2,3,2,3
https://engineering.mercer.edu/academic-programs/undergraduate-programs/civil-engineering/,text/html; charset=UTF-8,200,Indexable,Civil Engineering Degree—Bachelor of Science in Engineering,59,538,"Design, build and maintain modern infrastructure with a civil engineering degree. Excel in graduate school or a new career with a civil engineering degree.",155,945,Civil Engineering,17,Meet Mario Ferruzzi CALS New Dean,33,949,151.0,147496,39657,949,151.0,6.285,1.08,270,173,0,25,15,0,1.114,2,2,3,3,2,3
https://www.onu.edu/academics/civil-engineering,text/html; charset=UTF-8,200,Indexable,Civil Engineer Major (BSCE) | Ohio Northern University,54,473,"Learn how civil engineers with a BSCE degree from ONU learn to make infrastructure dreams into reality, from clean drinking water and safe roadways.",148,927,Civil Engineering Degree from ONU,33,Get Ready to Jump in 2024,25,1793,307.0,163802,43818,1793,307.0,5.84,1.08,90,71,0,19,19,0,2.81,2,2,3,3,2,3
https://www.oit.edu/academics/degrees/civil-engineering,text/html; charset=UTF-8,200,Indexable,Civil Engineering Degree Program | Oregon Tech,46,425,Earn your bachelor's or master's degree in civil engineering with Oregon Tech! Civil Engineering students at Oregon Tech learn in modern labs from experienced faculty.,167,1034,Civil Engineering,17,Mizzou Engineering,18,1245,251.0,142672,27531,1245,251.0,4.96,1.08,214,92,0,14,10,0,3.223,2,2,3,4,2,3
https://catalogs.nmsu.edu/nmsu/engineering/civil-engineering/civil-engineering-general-bachelor-science-civil-engineering/,text/html; charset=UTF-8,200,Indexable,Civil Engineering - Bachelor of Science in Civil Engineering | New Mexico State University Academic Catalog,107,945,"New to abstract painting with acrylics? Discover the power of acrylic 
mediums for creating dimension, depth, and adding transparency to your 
vibrant artworks. Explore the advantages of acrylic mediums and how they 
can improve your techniques. Experiencing with mediums is a perfect way for 
artists seeking to enhance their skills and craft.",348,0,Civil Engineering - Bachelor of Science in Civil Engineering,60,Ask for info,12,1599,299.0,179557,179557,1599,299.0,5.348,1.08,747,689,0,1,1,0,1.84,2,2,3,1,3,3
https://www.siue.edu/academics/graduate/degrees-and-programs/civil-engineering/,text/html,200,Indexable,Civil Engineering (MS),22,195,A shrunken crew-neck sweatshirt in three views with chevron pieced colorblocking in sizes 0 - 30,96,0,Civil Engineering (MS),22,See why the Hyundai PALISADE is better than the Honda Pilot ⁠ Claim based on comparison of specifications on manufacturer websites.,131,822,131.0,52396,52396,822,131.0,6.275,1.08,135,79,0,41,27,0,1.421,2,3,2,1,2,3
https://cee.vt.edu/Graduate-menu/prospective_graduate_students.html,text/html;charset=utf-8,200,Indexable,Prospective Graduate Students  | Civil & Environmental Engineering | Virginia Tech,82,717,"Prospective graduate students should refer to the information in the dropdown menu under “Prospective Graduate Students.” That will share information about CEE at Virginia Tech, as well as guide you through the application process and required materials needed to apply. Additional resources can be found below:",311,1954,Prospective Graduate Students,29,Ask for info,12,4232,737.0,113572,22415,4232,737.0,5.742,1.08,130,99,0,12,10,0,1.997,2,2,3,4,2,3
https://ceg.osu.edu/civil-engineering-graduate-studies-program-cegsp-overview,text/html; charset=UTF-8,200,Indexable,"Civil Engineering Graduate Studies Program (CEGSP) Overview | Civil, Environmental and Geodetic Engineering",107,973,Discover the Wooden Chair by Marc Newson crafted by Cappellini. Shop the exclusive selection of Lounge Chairs on Artemest online store.,135,0,Civil Engineering Graduate Studies Program (CEGSP) Overview,59,2024–25 Ski Passport grades 3–6,31,367,65.0,121619,19205,367,65.0,5.646,1.08,179,97,0,5,5,0,1.374,2,2,3,1,3,3
https://cee.engin.umich.edu/graduate-studies/phd-programs/,text/html; charset=UTF-8,200,Indexable,PhD Programs - Civil and Environmental Engineering,50,461,"Are you learning calligraphy, a hand lettering beginner, but don't know where to start? This faux calligraphy or fauxligraphy basics tutorial is for you!",153,0,PhD Programs,12,College of Agriculture and Life Sciences,40,579,100.0,142939,23726,579,100.0,5.79,1.08,126,101,0,6,6,0,2.654,2,2,3,1,2,3
https://www.ycp.edu/academics/programs/civil-engineering,text/html; charset=UTF-8,200,Indexable,Civil Engineering | York College of Pennsylvania,48,417,"Explore your math bachelor’s degree options at Northern Arizona University. Read about program details, campus availability, and apply today!",141,0,Civil Engineering,17,Working with Normalization Rules,32,768,164.0,103826,22675,768,164.0,4.683,1.08,82,65,0,13,11,0,1.57,2,2,3,1,2,3
https://engineering.unl.edu/cee/,text/html; charset=utf-8,200,Indexable,Civil & Environmental Engineering | College of Engineering | University of Nebraska–Lincoln,91,801,"The Civil and Environmental Engineering program at the University of Nebraska-Lincoln (UNL) was originally established as the Department of Civil Engineering in 1877. Today, we lead the College of Engineering in extramural research funding and boast the highest percentage of endowed professors in the College of Engineering. Our degree programs are offered in both Lincoln and",377,2361,Civil & Environmental Engineering,33,Naive implemantation of the backward pass through the BatchNorm-Layer,69,285,63.0,87288,24718,285,63.0,4.524,1.08,95,73,0,7,7,0,7.628,2,2,3,4,2,3
https://civil.olemiss.edu/,text/html; charset=UTF-8,200,Indexable,Ole Miss Civil Engineering,26,228,Come study civil engineering at the University of Mississippi - learn how to design and build structures safely and sustainably,127,774,Ole Miss CIVIL,14,99 Bottles of OOP - 2nd Edition,31,127,31.0,91591,91591,127,31.0,4.097,1.08,28,21,0,11,10,0,10.72,2,2,3,3,2,3
https://www.ccee.iastate.edu/,text/html; charset=UTF-8,200,Indexable,"Department of Civil, Construction and Environmental Engineering – Iowa State University Department of Civil, Construction and Environmental Engineering Website",159,1439,"Iowa State University Department of Civil, Construction and Environmental Engineering Website",93,590,"Department of Civil, Construction and Environmental Engineering",63,Mathematics,11,407,71.0,56442,12149,407,71.0,5.732,2.15,95,58,0,5,5,0,1.659,2,2,2,3,3,4
https://www.cpp.edu/engineering/ce/index.shtml,text/html; charset=UTF-8,200,Indexable,What is Civil Engineering,25,218,"Civil Engineering, College of Engineering",41,249,What is Civil Engineering,25,Get Ready to Jump in 2024,25,1342,214.0,60549,60549,1342,214.0,6.271,1.08,35,25,0,2,2,0,4.549,2,2,2,3,2,3
https://ccee.ncsu.edu/academics/graduate-programs/,text/html; charset=UTF-8,200,Indexable,"Graduate Programs | Department of Civil, Construction, and Environmental Engineering",84,765,"Department of Civil, Construction, and Environmental Engineering",64,405,Graduate Programs,17,Mathematics,11,1028,184.0,101193,23854,1028,184.0,5.587,1.08,126,69,0,24,16,0,2.486,2,2,2,3,2,3
https://cse.lmu.edu/graduateprograms/msce/,text/html; charset=UTF-8,200,Indexable,Master of Science in Engineering in Civil Engineering - Loyola Marymount University,83,734,Earn your Master of Science in Civil Engineering at Loyola Marymount Universityand learn essential tools for sustainably managing and solving complex environmental problems.,173,1094,Master of Science in Engineering in Civil Engineering,53,GUIDELINES,10,874,185.0,53966,9741,874,185.0,4.724,1.08,140,58,0,11,11,0,3.017,2,2,3,4,2,3
https://ceae.ku.edu/,text/html; charset=UTF-8,200,Indexable,"Welcome to the Civil, Environmental and Architectural Engineering Department | Civil, Environmental & Architectural Engineering",127,1130,You don’t mention where the chair came apart. But here’s a general process I use when repairing a chair. I do this professionally so I can’t have my work end up causing an injury. All loose joints need to be cleaned of all residual glue. This mean...,250,0,"Civil, Environmental & Architectural Engineering",48,2024–25 Ski Passport grades 3–6,31,421,95.0,107049,19608,421,95.0,4.432,1.08,135,99,0,14,11,0,1.561,2,2,3,1,3,4
https://ccee.udel.edu/,text/html; charset=UTF-8,200,Indexable,"Civil, Construction and Environmental Engineering",49,442,"UD Civil & Environmental Engineering offers three undergraduate majors in Civil Engineering, Environmental Engineering & Construction Engineering and Management.",161,1030,B.S. in Mathematics & Computer Science,38,Updated US and Canadian Normalization Factors for TRACI 2.1,59,587,142.0,279108,62525,587,142.0,4.134,1.08,89,66,0,9,9,0,0.563,2,2,3,4,2,3
https://catalog.twu.edu/undergraduate/arts-sciences/mathematics/mathematics-bs/,text/html; charset=UTF-8,200,Indexable,Bachelor of Science in Mathematics | Texas Woman's University Catalog,69,637,Find your Boston Celtics Mens Hoodies and sweatshirts at the Official Boston Celtics Shop. Browse our selection of Celtics hoodies and sweatshirts for every Celtics fan at Official Boston Celtics Shop.,201,0,Bachelor of Science in Mathematics,34,Easy Boneless Chicken Biryani Recipe,36,989,228.0,43582,43582,989,228.0,4.338,1.09,151,116,0,8,8,0,2.033,2,2,3,1,2,3
https://olemiss.edu/programs/libarts/bachelor-science-mathematics/,text/html; charset=UTF-8,200,Indexable,Bachelor of Science in Mathematics | Ole Miss,45,409,Discover the Bachelor of Science in Mathematics program at the University of Mississippi. Master mathematical theories and problem-solving skills.,146,914,Bachelor of Science in Mathematics,34,Choose a Location,17,1613,369.0,117418,14238,1613,369.0,4.371,1.09,120,90,0,11,9,0,1.391,2,2,3,3,2,3
https://online.iu.edu/degrees/mathematics-bs-undergraduate.html,text/html; charset=UTF-8,200,Indexable,"Mathematics, BS: Degrees: Indiana University",44,399,Discover the power of math with Indiana University's online mathematics bachelor’s degree ranked in the top 10 by U.S. News and World Report.,141,892,"Mathematics, B.S.",17,Give Feedback,13,854,180.0,72575,10259,854,180.0,4.744,1.09,37,30,0,5,5,0,2.083,2,2,3,3,2,3
https://mycatalog.txstate.edu/undergraduate/science-engineering/mathematics/mathematics-bs/,text/html; charset=UTF-8,200,Indexable,Bachelor of Science (B.S.) Major in Mathematics | Texas State University,72,637,"UF/IFAS Extension bring the power of UF’s research and education to every county in Florida. We support farmers and growers, home and business owners, youth and families through science-based programs, information and accessible expertise.",239,0,Bachelor of Science (B.S.) Major in Mathematics,47,RAISING A CHILD WITH ANXIETY OR OCD?,36,1055,233.0,34626,34626,1055,233.0,4.528,1.09,153,108,0,10,6,0,0.945,2,2,3,1,2,3
https://admissions.carleton.ca/programs/mathematics/,text/html; charset=UTF-8,200,Indexable,Mathematics (BMath) - Undergraduate Admissions - Carleton University,68,630,"I have this maple rocker, having sat in front of the stove for a month or so it has dried out and a back leg joint loosened up. It is not a terribly old rocker 60’s-80’s vintage, so presumably not hide glue. I don't want to use gorilla glue because it foams and expands, i am contemplating epoxy w...",300,0,Undergraduate Admissions,24,Mathematics (BMath),19,791,165.0,132808,28728,791,165.0,4.794,1.09,156,87,0,10,6,0,9.898,2,2,3,1,2,3
https://www.snhu.edu/online-degrees/bachelors/ba-in-mathematics,text/html; charset=utf-8,200,Indexable,Online Math Degree | Bachelor's in Mathematics | SNHU,53,490,Dive into real-world problems using math with SNHU's online Math BA degree.,75,483,Online Math Degree Bachelor’s in Mathematics,44,Mathematics,11,4897,807.0,180315,37428,4897,807.0,6.068,1.09,121,85,0,10,10,0,3.66,2,2,2,3,2,3
https://www.uml.edu/sciences/mathematics/programs/mathematics-major.aspx,text/html; charset=utf-8,200,Indexable,Mathematics Major | Mathematics & Statistics | Kennedy College of Sciences | UMass Lowell,89,815,"Major in Math at UMass Lowell in Massachusetts. Our Bachelor of Science in Mathematics will prepare you for careers in diverse fields, including education, engineering, finance, actuarial positions, programming, social sciences and statistics.",243,1493,Mathematics Major,17,Title:FateZero: Fusing Attentions for Zero-shot Text-based Video Editing,72,2901,712.0,81963,15218,2901,712.0,4.074,1.09,223,126,0,14,12,0,1.854,2,2,3,4,2,3
https://drexel.edu/coas/academics/undergraduate-programs/mathematics/,text/html; charset=utf-8,200,Indexable,Bachelor of Mathematics (BA & BS) | CoAS | Drexel University,60,539,Math majors gain the abstract and computational skills to target their ambitions. Learn how to earn a Bachelor’s of Mathematics at Drexel University now.,153,948,College of Arts and Sciences,28,Bachelor's Degrees in Mathematics,33,853,158.0,56408,56408,853,158.0,5.399,1.09,128,91,0,5,5,0,2.356,2,2,3,3,2,3
https://www.untdallas.edu/las/undergrad-programs/mathematics-bachelor-degree-program.php,text/html; charset=UTF-8,200,Indexable,"Mathematics Bachelors Degree Programs | Dallas, Texas",53,499,"The Mathematics bachelor degree program at UNT Dallas is affordable, and is also available with a certificate to teach in middle school and high school.",152,939,Mathematics Bachelor's Degree Program,37,"Civil, Architectural and Environmental Engineering",50,499,102.0,52116,52116,499,102.0,4.892,1.09,88,73,0,30,30,0,5.507,2,2,3,3,2,3
https://vu.nl/en/education/bachelor/mathematics,text/html; charset=utf-8,200,Indexable,Bachelor's Mathematics - Vrije Universiteit Amsterdam,53,480,Using a model to prevent a virus infection from spreading? Prime numbers that provide encryption for instant messages? Choose the Bachelor of Mathematics!,154,984,Mathematics,11,Easy Boneless Chicken Biryani Recipe,36,788,132.0,56711,56711,788,132.0,5.97,1.09,22,15,0,0,0,0,1.19,2,2,3,3,2,3
https://uh.edu/nsm/math/undergraduate/major-minor-programs/,text/html; charset=UTF-8,200,Indexable,Degree Programs - University of Houston,39,359,Degree Programs,15,108,Department of Mathematics,25,Degree Programs,15,619,154.0,43308,13639,619,154.0,4.019,1.09,112,95,0,16,15,0,3.864,2,2,2,3,2,3
https://csm.fresnostate.edu/math/degrees/bs/index.html,text/html; charset=UTF-8,200,Indexable,BS in Mathematics - Department of Mathematics,45,431,Requirements and notes regarding the Bachelor of Science Degree in Mathematics,78,511,Bachelor of Science in Mathematics,34,Advanced Object Oriented Programming (4340701),46,771,111.0,33325,33325,771,111.0,6.946,1.09,81,62,0,14,11,0,10.815,2,2,2,3,2,3
https://bulletin.temple.edu/undergraduate/science-technology/mathematics-bs/,text/html; charset=UTF-8,200,Indexable,Mathematics BS < Temple University,34,323,"Bradley Hospital, the nation’s first psychiatric hospital for children, presents Parenting Matters.",99,0,Bulletin 2024-2025,18,Mathematics BS,14,1464,340.0,77123,77123,1464,340.0,4.306,1.09,282,202,0,0,0,0,7.158,2,2,2,1,2,3
https://und.edu/programs/mathematics-bs/requirements.html,text/html; charset=UTF-8,200,Indexable,Mathematics Degree Requirements | University of North Dakota,60,558,Complete these mathematics degree requirements to earn your bachelor’s degree in mathematics from the UND College of Arts & Sciences.,133,863,Mathematics Degree Requirements,31,Naive implemantation of the backward pass through the BatchNorm-Layer,69,875,183.0,47715,9257,875,183.0,4.781,1.09,55,32,0,17,15,0,4.268,2,2,3,3,2,3
https://study.uq.edu.au/study-options/programs/bachelor-mathematics-2460,text/html; charset=UTF-8,200,Indexable,Bachelor of Mathematics - Study - The University of Queensland,62,561,"Learn how to solve theoretical and applied mathematics problems across science, engineering, information technology, economics and business, and gain the foundation for a successful career.",189,1199,Bachelor of Mathematics,23,Advanced Object Oriented Programming (4340701),46,5328,867.0,250981,45414,5328,867.0,6.145,1.09,403,268,0,12,10,0,1.82,2,2,3,4,2,3
