"Original Url","Address","Content Type","Status Code","Status","Indexability","Indexability Status","Title 1","Title 1 Length","Title 1 Pixel Width","Title 2","Title 2 Length","Title 2 Pixel Width","Meta Description 1","Meta Description 1 Length","Meta Description 1 Pixel Width","Meta Keywords 1","Meta Keywords 1 Length","H1-1","H1-1 Length","H1-2","H1-2 Length","H2-1","H2-1 Length","H2-2","H2-2 Length","Meta Robots 1","Meta Robots 2","X-Robots-Tag 1","Meta Refresh 1","Canonical Link Element 1","Canonical Link Element 2","rel=""next"" 1","rel=""prev"" 1","HTTP rel=""next"" 1","HTTP rel=""prev"" 1","amphtml Link Element","Size (bytes)","Transferred (bytes)","Word Count","Sentence Count","Average Words Per Sentence","Flesch Reading Ease Score","Readability","Text Ratio","Crawl Depth","Folder Depth","Link Score","Inlinks","Unique Inlinks","Unique JS Inlinks","% of Total","Outlinks","Unique Outlinks","Unique JS Outlinks","External Outlinks","Unique External Outlinks","Unique External JS Outlinks","Closest Similarity Match","No. Near Duplicates","Spelling Errors","Grammar Errors","Hash","Response Time","Last Modified","Redirect URL","Redirect Type","Cookies","HTTP Version","URL Encoded Address","Crawl Timestamp"
"https://catalog.twu.edu/undergraduate/arts-sciences/mathematics/mathematics-bs/","https://catalog.twu.edu/undergraduate/arts-sciences/mathematics/mathematics-bs/","text/html; charset=UTF-8","200","OK","Indexable","","Bachelor of Science in Mathematics | Texas Woman's University Catalog","69","637","","0","0","","0","0","","0","Bachelor of Science in Mathematics","34","","0","Texas Woman's University","24","Marketable Skills","17","","","","","","","","","","","","43582","43582","989","228","4.338","78.654","Fairly Easy","18.738","0","4","","10","1","0","1.090","151","116","0","8","8","0","","","","","682b602eed9d67191699e9698c729a21","2.033","Tue, 13 Aug 2024 16:12:02 GMT","","","","1.1","https://catalog.twu.edu/undergraduate/arts-sciences/mathematics/mathematics-bs/","2024-11-30 14:39:16"
"https://olemiss.edu/programs/libarts/bachelor-science-mathematics/","https://olemiss.edu/programs/libarts/bachelor-science-mathematics/","text/html; charset=UTF-8","200","OK","Indexable","","Bachelor of Science in Mathematics | Ole Miss","45","409","","0","0","Discover the Bachelor of Science in Mathematics program at the University of Mississippi. Master mathematical theories and problem-solving skills.","146","914","Ole Miss, University of Mississippi, Bachelor of Science, BS, Mathematics, Math","79","Bachelor of Science in Mathematics","34","","0","About this Program","18","Program Information","19","","","","","","","","","","","","117418","14238","1613","369","4.371","65.664","Normal","10.148","0","3","","2","1","0","1.090","120","90","0","11","9","0","","","","","bf5d09cfe65a9e52215abeb4df7bd7f","1.391","","","","","1.1","https://olemiss.edu/programs/libarts/bachelor-science-mathematics/","2024-11-30 14:41:35"
"https://online.iu.edu/degrees/mathematics-bs-undergraduate.html","https://online.iu.edu/degrees/mathematics-bs-undergraduate.html","text/html; charset=UTF-8","200","OK","Indexable","","Mathematics, BS: Degrees: Indiana University","44","399","","0","0","Discover the power of math with Indiana University's online mathematics bachelor’s degree ranked in the top 10 by U.S. News and World Report.","141","892","","0","Mathematics, B.S.","17","Give Feedback","13","Get your degree in mathematics","30","B.S. in Mathematics","19","max-snippet:-1, max-image-preview:large, max-video-preview:-1","","","","https://online.iu.edu/degrees/mathematics-bs-undergraduate.html","","","","","","","72575","10259","854","180","4.744","63.727","Normal","8.941","0","1","","1","1","0","1.090","37","30","0","5","5","0","","","","","193dbe23ab99a251d76988c152599987","2.083","","","","","1.1","https://online.iu.edu/degrees/mathematics-bs-undergraduate.html","2024-11-30 14:39:19"
"https://mycatalog.txstate.edu/undergraduate/science-engineering/mathematics/mathematics-bs/","https://mycatalog.txstate.edu/undergraduate/science-engineering/mathematics/mathematics-bs/","text/html; charset=UTF-8","200","OK","Indexable","","Bachelor of Science (B.S.) Major in Mathematics | Texas State University","72","637","","0","0","","0","0","","0","Bachelor of Science (B.S.) Major in Mathematics","47","","0","Minimum required: 120 semester credit hours","43","General Requirements","20","","","","","","","","","","","","34626","34626","1055","233","4.528","77.945","Fairly Easy","19.164","0","4","","10","1","0","1.090","153","108","0","10","6","0","","","","","e265940eb71533bf2fd71a65142537e9","0.945","Wed, 27 Nov 2024 19:37:50 GMT","","","","1.1","https://mycatalog.txstate.edu/undergraduate/science-engineering/mathematics/mathematics-bs/","2024-11-30 14:41:22"
"https://admissions.carleton.ca/programs/mathematics/","https://admissions.carleton.ca/programs/mathematics/","text/html; charset=UTF-8","200","OK","Indexable","","Mathematics (BMath) - Undergraduate Admissions - Carleton University","68","630","","0","0","","0","0","","0","Undergraduate Admissions","24","Mathematics (BMath)","19","Program Details","15","Areas of Study","14","index, follow, max-image-preview:large, max-snippet:-1, max-video-preview:-1","","","","https://admissions.carleton.ca/programs/mathematics/","","","","","","","132808","28728","791","165","4.794","49.989","Hard","7.073","0","2","","18","1","0","1.090","156","87","0","10","6","0","","","","","42935a99fba381c1356d58f53654bf03","9.898","","","","","1.1","https://admissions.carleton.ca/programs/mathematics/","2024-11-30 14:39:21"
"https://www.snhu.edu/online-degrees/bachelors/ba-in-mathematics","https://www.snhu.edu/online-degrees/bachelors/ba-in-mathematics","text/html; charset=utf-8","200","OK","Indexable","","Online Math Degree | Bachelor's in Mathematics | SNHU","53","490","","0","0","Dive into real-world problems using math with SNHU's online Math BA degree.","75","483","online math degree, online mathematics degree","45","Online Math Degree Bachelor’s in Mathematics","44","","0","Apply Now","9","Online Students","15","index,follow","","","","https://www.snhu.edu/online-degrees/bachelors/ba-in-mathematics","","","","","","","180315","37428","4897","807","6.068","56.146","Fairly Hard","19.950","0","2","","13","1","0","1.090","121","85","0","10","10","0","","","","","6d91ffac7ed39ba476291a583308a726","3.660","","","","","1.1","https://www.snhu.edu/online-degrees/bachelors/ba-in-mathematics","2024-11-30 14:40:32"
"https://www.uml.edu/sciences/mathematics/programs/mathematics-major.aspx","https://www.uml.edu/sciences/mathematics/programs/mathematics-major.aspx","text/html; charset=utf-8","200","OK","Indexable","","Mathematics Major | Mathematics & Statistics | Kennedy College of Sciences | UMass Lowell","89","815","","0","0","Major in Math at UMass Lowell in Massachusetts. Our Bachelor of Science in Mathematics will prepare you for careers in diverse fields, including education, engineering, finance, actuarial positions, programming, social sciences and statistics.","243","1493","","0","Mathematics Major","17","","0","Menu","4","Mathematics & Statistics","24","","","","","https://www.uml.edu/sciences/mathematics/programs/mathematics-major.aspx","","","","","","","81963","15218","2901","712","4.074","72.285","Fairly Easy","24.075","0","3","","2","1","0","1.090","223","126","0","14","12","0","","","","","cf1512f91df26f046f66638dd1a2b7f5","1.854","","","","","1.1","https://www.uml.edu/sciences/mathematics/programs/mathematics-major.aspx","2024-11-30 14:39:16"
"https://drexel.edu/coas/academics/undergraduate-programs/mathematics/","https://drexel.edu/coas/academics/undergraduate-programs/mathematics/","text/html; charset=utf-8","200","OK","Indexable","","Bachelor of Mathematics (BA & BS) | CoAS | Drexel University","60","539","","0","0","Math majors gain the abstract and computational skills to target their ambitions. Learn how to earn a Bachelor’s of Mathematics at Drexel University now.","153","948","bachelor of mathematics, ba in math, bs mathematics, bs in math, ba mathematics, bachelor of science in mathematics, bachelor of arts in mathematics, bachelor of math, bachelors degree in math, define degree in math, mathematics placement test, bachelors degree in mathematics, what is degree in mathematics, bachelor degree in mathematics requirements, what is bs mathematics, undergraduate degree in math","406","College of Arts and Sciences","28","Bachelor's Degrees in Mathematics","33","BA in Mathematics","17","BS in Mathematics","17","","","","","https://drexel.edu/coas/academics/undergraduate-programs/mathematics/","","","","","","","56408","56408","853","158","5.399","54.967","Fairly Hard","13.507","0","4","","7","1","0","1.090","128","91","0","5","5","0","","","","","c5ed215b64d9d790c6c9b19695d2f8c","2.356","","","","","1.1","https://drexel.edu/coas/academics/undergraduate-programs/mathematics/","2024-11-30 14:41:23"
"https://www.untdallas.edu/las/undergrad-programs/mathematics-bachelor-degree-program.php","https://www.untdallas.edu/las/undergrad-programs/mathematics-bachelor-degree-program.php","text/html; charset=UTF-8","200","OK","Indexable","","Mathematics Bachelors Degree Programs | Dallas, Texas","53","499","","0","0","The Mathematics bachelor degree program at UNT Dallas is affordable, and is also available with a certificate to teach in middle school and high school.","152","939","","0","Mathematics Bachelor's Degree Program","37","","0","Program Coordinator","19","Quick Links","11","","","","","https://www.untdallas.edu/las/undergrad-programs/mathematics-bachelor-degree-program.php","","","","","","","52116","52116","499","102","4.892","48.267","Hard","9.300","0","2","","7","1","0","1.090","88","73","0","30","30","0","","","","","b94e44432eba8f54dddf80db8eada71a","5.507","","","","","1.1","https://www.untdallas.edu/las/undergrad-programs/mathematics-bachelor-degree-program.php","2024-11-30 14:39:35"
"https://vu.nl/en/education/bachelor/mathematics","https://vu.nl/en/education/bachelor/mathematics","text/html; charset=utf-8","200","OK","Indexable","","Bachelor's Mathematics - Vrije Universiteit Amsterdam","53","480","","0","0","Using a model to prevent a virus infection from spreading? Prime numbers that provide encryption for instant messages? Choose the Bachelor of Mathematics!","154","984","","0","Mathematics","11","","0","Discover your Mathematics study programme","41","Change your world, study Mathematics","36","","","","","https://vu.nl/en/education/bachelor/mathematics","","","","","","","56711","56711","788","132","5.970","55.947","Fairly Hard","8.987","0","3","","4","1","0","1.090","22","15","0","0","0","0","","","","","89fe05fce751a3f8cae88e8612f8e0ea","1.190","","","","","1.1","https://vu.nl/en/education/bachelor/mathematics","2024-11-30 14:39:11"
"https://uh.edu/nsm/math/undergraduate/major-minor-programs/","https://uh.edu/nsm/math/undergraduate/major-minor-programs/","text/html; charset=UTF-8","200","OK","Indexable","","Degree Programs - University of Houston","39","359","","0","0","Degree Programs","15","108","","0","Department of Mathematics","25","Degree Programs","15","Undergraduate Studies","21","NSM Helpful Links","17","","","","","","","","","","","","43308","13639","619","154","4.019","61.436","Normal","22.488","0","4","","3","1","0","1.090","112","95","0","16","15","0","","","","","781cb074f0677fc1c066ba94b8bde091","3.864","","","","","1.1","https://uh.edu/nsm/math/undergraduate/major-minor-programs/","2024-11-30 14:40:13"
"https://csm.fresnostate.edu/math/degrees/bs/index.html","https://csm.fresnostate.edu/math/degrees/bs/index.html","text/html; charset=UTF-8","200","OK","Indexable","","BS in Mathematics - Department of Mathematics","45","431","","0","0","Requirements and notes regarding the Bachelor of Science Degree in Mathematics","78","511","Math, BS, Bachelor of Science, Mathematics","42","Bachelor of Science in Mathematics","34","","0","Quick Links","11","Quick Links","11","index,follow","index,follow","","","https://csm.fresnostate.edu/math/degrees/bs/index.html","","","","","","","33325","33325","771","111","6.946","52.091","Fairly Hard","19.127","0","3","","9","1","0","1.090","81","62","0","14","11","0","","","","","1a7a79576976eff0e286f1a9619ea145","10.815","","","","","1.1","https://csm.fresnostate.edu/math/degrees/bs/index.html","2024-11-30 14:40:16"
"https://www.metrostate.edu/academics/programs/mathematics-ba","https://www.metrostate.edu/academics/programs/mathematics-ba","","0","DNS lookup failed","Non-Indexable","No Response","","0","0","","0","0","","0","0","","0","","0","","0","","0","","0","","","","","","","","","","","","0","0","0","","","","","0.000","0","2","","0","0","0","0.000","0","0","0","0","0","0","","","","","","","","","","","","https://www.metrostate.edu/academics/programs/mathematics-ba","2024-11-30 14:39:32"
"https://bulletin.temple.edu/undergraduate/science-technology/mathematics-bs/","https://bulletin.temple.edu/undergraduate/science-technology/mathematics-bs/","text/html; charset=UTF-8","200","OK","Indexable","","Mathematics BS < Temple University","34","323","","0","0","","0","0","","0","Bulletin 2024-2025","18","Mathematics BS","14","2024-2025 Edition","17","Overview","8","","","","","","","","","","","","77123","77123","1464","340","4.306","77.125","Fairly Easy","17.992","0","3","","9","1","0","1.090","282","202","0","0","0","0","","","","","7859415d1048967ced170d34ea6f62c4","7.158","Fri, 01 Nov 2024 20:21:57 GMT","","","","1.1","https://bulletin.temple.edu/undergraduate/science-technology/mathematics-bs/","2024-11-30 14:41:29"
"https://und.edu/programs/mathematics-bs/requirements.html","https://und.edu/programs/mathematics-bs/requirements.html","text/html; charset=UTF-8","200","OK","Indexable","","Mathematics Degree Requirements | University of North Dakota","60","558","","0","0","Complete these mathematics degree requirements to earn your bachelor’s degree in mathematics from the UND College of Arts & Sciences.","133","863","","0","Mathematics Degree Requirements","31","","0","General Education Courses","25","Mathematics Degree Requirements Disclaimer","42","","","","","https://und.edu/programs/mathematics-bs/requirements.html","","","","","","","47715","9257","875","183","4.781","61.788","Normal","14.762","0","2","","3","1","0","1.090","55","32","0","17","15","0","","","","","624f01802856da7db7a50549db6d7705","4.268","","","","","1.1","https://und.edu/programs/mathematics-bs/requirements.html","2024-11-30 14:40:06"
"https://study.uq.edu.au/study-options/programs/bachelor-mathematics-2460","https://study.uq.edu.au/study-options/programs/bachelor-mathematics-2460","text/html; charset=UTF-8","200","OK","Indexable","","Bachelor of Mathematics - Study - The University of Queensland","62","561","","0","0","Learn how to solve theoretical and applied mathematics problems across science, engineering, information technology, economics and business, and gain the foundation for a successful career.","189","1199","","0","Bachelor of Mathematics","23","","0","Overview","8","Events","6","","","","","https://study.uq.edu.au/study-options/programs/bachelor-mathematics-2460","","","","","","","250981","45414","5328","867","6.145","46.625","Hard","18.583","0","2","","27","1","0","1.090","403","268","0","12","10","0","","","","","e7f72169ebc742b4718cdabf07c33d8e","1.820","Sat, 30 Nov 2024 08:00:22 GMT","","","","1.1","https://study.uq.edu.au/study-options/programs/bachelor-mathematics-2460","2024-11-30 14:39:13"
"https://www.stedwards.edu/academics/majors-programs/mathematics","https://www.stedwards.edu/academics/majors-programs/mathematics","text/html; charset=UTF-8","200","OK","Indexable","","Mathematics (BA, BS and Minor) | St. Edwards University in Austin, TX","69","615","","0","0","Pursue a Mathematics degree at St. Edward’s to solve real-world problems and open career doors.","95","606","","0","Mathematics","11","","0","Pursue Your Passion for Problem-Solving","39","Why earn your Mathematics degree at St. Edward’s?","49","","","","","https://www.stedwards.edu/academics/majors-programs/mathematics","","","","","","","189014","51867","2153","432","4.984","52.066","Fairly Hard","15.729","0","2","","3","1","0","1.090","116","91","0","17","14","0","","","","","670a922da131c1ba8ea657cac4f23376","2.336","Fri, 29 Nov 2024 21:52:15 GMT","","","","1.1","https://www.stedwards.edu/academics/majors-programs/mathematics","2024-11-30 14:40:17"
"https://www.clarkson.edu/academics/majors-minors/mathematics","https://www.clarkson.edu/academics/majors-minors/mathematics","text/html; charset=UTF-8","200","OK","Indexable","","BS in Mathematics | Clarkson University","39","350","","0","0","Learn to solve problems in fields from astronomy and biology to social networks, zoology and everything in between with a bachelor's in mathematics from Clarkson University.","173","1084","bachelor of mathematics, BS mathematics, mathematics major, math major","70","Bachelor of Science in Mathematics","34","","0","Unlock the Possibilities of Mathematics","39","Why Study Mathematics at Clarkson?","34","","","","","https://www.clarkson.edu/academics/majors-minors/mathematics","","","","","","","54026","15803","1776","319","5.567","64.614","Normal","24.213","0","2","","1","1","0","1.090","91","67","0","11","11","0","","","","","c60db8a8a40bcfa03ec8cb3d5b31843e","1.962","Fri, 29 Nov 2024 21:11:44 GMT","","","","1.1","https://www.clarkson.edu/academics/majors-minors/mathematics","2024-11-30 14:39:05"
"https://www.unr.edu/degrees/majors/math","https://www.unr.edu/degrees/majors/math","text/html; charset=utf-8","200","OK","Indexable","","Bachelor's Degree in Mathematics | Degrees & Programs | University of Nevada, Reno","82","747","","0","0","Learn more about majoring in math at the University of Nevada, Reno, and find out about careers you can pursue with a degree in mathematics.","140","883","","0","Bachelor's degree in math","25","","0","Quicklinks","10","Search","6","","","","","https://www.unr.edu/degrees/majors/math","","","","","","","79091","19375","834","121","6.893","51.535","Fairly Hard","9.827","0","2","","4","1","0","1.090","75","54","0","8","8","0","","","","","63b4167851b130f621ac82cef40fbb7a","3.532","","","","","1.1","https://www.unr.edu/degrees/majors/math","2024-11-30 14:41:26"
"https://www.gcu.edu/degree-programs/bachelor-science-mathematics-secondary-education","https://www.gcu.edu/degree-programs/bachelor-science-mathematics-secondary-education","text/html; charset=UTF-8","200","OK","Indexable","","Bachelor’s Degree in Math for Secondary Education | GCU","55","507","","0","0","This bachelor’s degree in math for secondary education can provide the knowledge and skills to pursue a career in teaching secondary mathematics. Learn more here.","162","1029","math teacher degree, BS in math","31","Bachelor’s Degree in Math for Secondary Education","49","","0","Study to Become a Secondary Math Teacher","40","Benefits of a Bachelor’s Degree in Math for Secondary Education From GCU","72","","","","","https://www.gcu.edu/degree-programs/bachelor-science-mathematics-secondary-education","","","","","","","202215","32601","4372","776","5.634","43.546","Hard","19.586","0","1","","7","1","0","1.090","138","102","0","16","16","0","","","","","276ecd85f0e8770d9db4e737ec5059d4","1.973","Sat, 30 Nov 2024 09:40:36 GMT","","","","1.1","https://www.gcu.edu/degree-programs/bachelor-science-mathematics-secondary-education","2024-11-30 14:40:36"
"https://www.utpb.edu/academics/programs/mathematics/bs-mathematics","https://www.utpb.edu/academics/programs/mathematics/bs-mathematics","text/html","200","OK","Indexable","","Mathematics Bachelor's Degree Program in Texas | BS in Mathematics - The University of Texas Permian Basin | UTPB","113","1039","","0","0","","0","0","","0","Mathematics Bachelor's Degree","29","","0","Bachelor of Science (BS) in Mathematics","39","Careers for Math Majors","23","","","","","https://www.utpb.edu/academics/programs/mathematics/bs-mathematics","","","","","","","80426","80426","650","138","4.710","62.269","Normal","8.965","0","3","","4","1","0","1.090","147","97","0","30","20","0","","","","","69051f4e65fc21b146078475298ea9cd","11.950","","","","","1.1","https://www.utpb.edu/academics/programs/mathematics/bs-mathematics","2024-11-30 14:40:39"
"https://cnasstudent.ucr.edu/mathematics","https://cnasstudent.ucr.edu/mathematics","text/html; charset=UTF-8","200","OK","Indexable","","Mathematics | CNAS Undergraduate Academic Advising Center","57","559","","0","0","Overview The Department of Mathematics offers a B.A. and B.S. degree in programs that share a common, solid mathematical foundation but differ in their specializations in the pure and applied areas of mathematics. These programs can provide the basis for careers in mathematics itself or within the many scientific and business fields, which, in today’s technological society, depend on a basic knowledge of mathematical methods.","429","2686","","0","CNAS Undergraduate Academic Advising Center","43","Mathematics","11","Overview","8","Mathematics Advising","20","","","","","https://cnasstudent.ucr.edu/mathematics","","","","","","","84140","18019","1057","242","4.368","57.133","Fairly Hard","10.849","0","0","","9","1","0","1.090","113","74","0","10","9","0","","","","","dc194b018fdf9e5476afd316c0788b9e","3.701","Sat, 23 Nov 2024 01:07:29 GMT","","","","1.1","https://cnasstudent.ucr.edu/mathematics","2024-11-30 14:38:53"
"http://www-math.mit.edu/undergraduate","http://www-math.mit.edu/undergraduate","text/html; charset=iso-8859-1","302","Found","Non-Indexable","Redirected","","0","0","","0","0","","0","0","","0","","0","","0","","0","","0","","","","","","","","","","","","218","218","0","","","","","0.000","0","0","","0","0","0","0.000","0","0","0","0","0","0","","","","","","1.130","","https://math.mit.edu/undergraduate","HTTP Redirect","","1.1","http://www-math.mit.edu/undergraduate","2024-11-30 14:40:17"
"https://www.ohio.edu/cas/math/undergraduate","https://www.ohio.edu/cas/math/undergraduate","text/html; charset=UTF-8","200","OK","Indexable","","Mathematics Degree | Bachelor’s Degree (BS & BA) | Ohio University","66","597","","0","0","See what you can learn with a mathematics degree from Ohio University, part of our bachelor's program. This is the kind of degree you can take anywhere!","152","950","","0","Earn a Mathematics Degree & Study the Universal Language of Math","64","","0","Info for:","9","Log In","6","","","","","https://www.ohio.edu/cas/math/undergraduate","","","","","","","98049","18615","1954","368","5.310","54.976","Fairly Hard","13.855","0","2","","5","1","0","1.090","181","131","0","26","14","0","","","","","d14c4a6e8d1db46d95795bd69bcf8acc","1.462","Fri, 29 Nov 2024 12:29:20 GMT","","","","1.1","https://www.ohio.edu/cas/math/undergraduate","2024-11-30 14:39:33"
"https://www.ocf.berkeley.edu/~abhishek/chicmath.htm","https://www.ocf.berkeley.edu/~abhishek/chicmath.htm","text/html","200","OK","Indexable","","Chicago undergraduate mathematics bibliography","46","443","","0","0","","0","0","","0","Chicago undergraduate mathematics bibliography","46","ELEMENTARY","10","Algebra","7","Geometry","8","","","","","","","","","","","","102965","36599","14786","1982","7.460","63.163","Normal","87.227","0","1","","40","1","0","1.090","41","2","0","0","0","0","","","","","7f86f95360ba7a1aa1d08032225c1b19","3.231","Thu, 04 Mar 2004 07:38:46 GMT","","","","1.1","https://www.ocf.berkeley.edu/~abhishek/chicmath.htm","2024-11-30 14:39:07"
"https://catalog.ku.edu/liberal-arts-sciences/math/bs/","https://catalog.ku.edu/liberal-arts-sciences/math/bs/","text/html; charset=UTF-8","200","OK","Indexable","","Bachelor of Science in Mathematics | The University of Kansas Academic Catalog","78","718","","0","0","","0","0","","0","2024-25 Academic Catalog","24","Bachelor of Science in Mathematics","34","Why study mathematics?","22","Undergraduate Admission","23","","","","","","","","","","","","103785","103785","3058","579","5.282","70.812","Fairly Easy","20.105","0","3","","9","1","0","1.090","330","228","0","4","4","0","","","","","64f737cff86d9229accfc8ffb6e8219c","1.554","Tue, 06 Aug 2024 15:53:16 GMT","","","","1.1","https://catalog.ku.edu/liberal-arts-sciences/math/bs/","2024-11-30 14:40:19"
"https://www.augusta.edu/programs/math-bs.php","https://www.augusta.edu/programs/math-bs.php","text/html; charset=UTF-8","200","OK","Indexable","","BS in Mathematics | Degree Program","34","325","","0","0","Are you a numbers person? An analytical thinker who understands the function and power of mathematics? If so, then the Mathematics program is for you.","150","959","","0","Mathematics, BS","15","","0","Program Information","19","Coursework","10","","","","","","","","","","","","43245","43245","855","151","5.662","54.349","Fairly Hard","13.930","0","1","","5","1","0","1.090","61","48","0","11","11","0","","","","","be81b409c72280d511b048c2fd9125bd","1.924","","","","","1.1","https://www.augusta.edu/programs/math-bs.php","2024-11-30 14:39:32"
