"https://www.stvincent.edu/academics/undergraduate-programs/programs/mathematics.html","https://www.stvincent.edu/academics/undergraduate-programs/programs/mathematics.html","text/html","200","OK","Indexable","","Bachelors in Mathematics | Latrobe, PA | Saint Vincent College","62","551","","0","0","Our best-in-class Bachelors in Mathematics degree program teaches you to comprehend current problems in mathematical terms using theories in chaos and fractals, cryptography, data compression algorithms, tomography, topology and turbulence.","240","1543","","0","Mathematics","11","","0","Curriculum Requirements","23","Program Highlights","18","index, follow","","","","https://www.stvincent.edu/academics/undergraduate-programs/programs/mathematics.html","","","","","","","276253","276253","1032","168","6.143","66.896","Normal","2.495","0","3","","2","1","0","1.090","57","37","0","6","6","0","","","","","2d82c39b71f72a2f28458e748206c3b7","2.433","Fri, 08 Nov 2024 13:49:15 GMT","","","","1.1","https://www.stvincent.edu/academics/undergraduate-programs/programs/mathematics.html","2024-11-30 14:38:59"
"https://www.uoguelph.ca/programs/bachelor-of-mathematics/","https://www.uoguelph.ca/programs/bachelor-of-mathematics/","text/html; charset=UTF-8","200","OK","Indexable","","Bachelor of Mathematics | University of Guelph","46","413","","0","0","Learn more about how the Bachelor of Mathematics degree at the University of Guelph empowers you to contribute to a number of fields, including business, technology and computing sectors.","187","1193","","0","Bachelor of Mathematics","23","","0","Why choose a Bachelor's degree in Mathematics?","46","What can you do with a bachelor's degree in Mathematics?","56","","","","","","","","","","","","362853","231862","588","90","6.533","49.132","Hard","1.087","0","2","","1","1","0","1.090","11","11","0","0","0","0","","","","","5ef5434028857489b7b8a7ab694de6ac","3.167","","","","","1.1","https://www.uoguelph.ca/programs/bachelor-of-mathematics/","2024-11-30 14:41:25"
"https://www.lamar.edu/academics/degrees/mathematics/mathematics-bachelors-degree.html","https://www.lamar.edu/academics/degrees/mathematics/mathematics-bachelors-degree.html","text/html; charset=UTF-8","200","OK","Indexable","","Bachelor's Degree in Mathematics - Lamar University","51","464","","0","0","The undergraduate programs in mathematics have multiple concentrations, including teacher certification, depending on what you wish to do upon graduation.","154","985","Bachelor of arts, Bachelor of science, mathematics  The Department of Mathematics offers both a Bachelor of Science and a Bachelor of Arts degree at the undergraduate level. Each of the B.S. and B.A. degrees have multiple concentration depending on what you wish to do upon graduation.","285","Bachelor's Degree in Mathematics","32","","0","Delivery Options:","17","Degree Descriptions","19","","","","","https://www.lamar.edu/academics/degrees/mathematics/mathematics-bachelors-degree.html","","","","","","","34439","34439","660","166","3.976","49.622","Hard","13.102","0","3","","4","1","0","1.090","65","43","0","7","7","0","","","","","5af9e18b51704efb8e240bdf382f21f6","2.171","Tue, 26 Nov 2024 16:20:38 GMT","","","","1.1","https://www.lamar.edu/academics/degrees/mathematics/mathematics-bachelors-degree.html","2024-11-30 14:39:54"
"https://www.atu.edu/degrees/bachelors/mathematics-education.php","https://www.atu.edu/degrees/bachelors/mathematics-education.php","text/html; charset=UTF-8","200","OK","Indexable","","Mathematics Education Bachelor's Degree","39","375","","0","0","The curriculum provides students with a background in mathematics and pedagogy that prepares them to teach secondary level mathematics.","135","882","mathematics, education, major, bachelor's, math degree, arkansas, arkansas tech, ATU, college of education","106","Mathematics Education Bachelor's Degree","39","LEARNING, NETWORKING, AND CAREER OPPORTUNITIES","46","Mathematics Education Bachelor's Degree","39","HANDS-ON LEARNING opportunities","31","","","","","https://www.atu.edu/degrees/bachelors/mathematics-education.php","","","","","","","63046","63046","854","153","5.582","32.366","Hard","15.445","0","2","","9","1","0","1.090","190","143","0","33","21","0","","","","","75b8abae18612371e231d05ac6989418","0.978","","","","","1.1","https://www.atu.edu/degrees/bachelors/mathematics-education.php","2024-11-30 14:40:38"
"https://www.ucf.edu/degree/mathematics-bs/","https://www.ucf.edu/degree/mathematics-bs/","text/html; charset=UTF-8","200","OK","Indexable","","Mathematics (BS) Degree | University of Central Florida","55","485","","0","0","As a mathetmatics major, you'll learn to use reasoning, logic and analysis to solve complex real-world problems from renowned faculty in Orlando, Florida.","154","949","","0","Bachelor of Science in Mathematics, BS","38","","0","Program at a Glance","19","Develop a Strong Mathematical Foundation","40","index, follow, max-image-preview:large, max-snippet:-1, max-video-preview:-1","","","","https://www.ucf.edu/degree/mathematics-bs/","","","","","","","112067","33169","2002","422","4.744","56.695","Fairly Hard","12.173","0","2","","7","1","0","1.090","64","56","0","4","4","0","","","","","c05b40561507dcd4b2c9c16fb913704a","3.086","","","","","1.1","https://www.ucf.edu/degree/mathematics-bs/","2024-11-30 14:40:51"
"http://catalog.illinois.edu/undergraduate/las/mathematics-bslas/","http://catalog.illinois.edu/undergraduate/las/mathematics-bslas/","text/html; charset=UTF-8","200","OK","Indexable","","Mathematics, BSLAS | University of Illinois Urbana-Champaign","60","546","","0","0","","0","0","","0","Course Catalog","14","Mathematics, BSLAS","18","University Resources","20","Print Options","13","","","","","","","","","","","","51235","51235","1194","223","5.354","64.581","Normal","20.363","0","3","","12","1","0","1.090","112","62","0","1","1","0","","","","","934933e0adc3a1462f3f800c749e8d02","3.161","Mon, 25 Nov 2024 19:37:00 GMT","","","","1.1","http://catalog.illinois.edu/undergraduate/las/mathematics-bslas/","2024-11-30 14:40:07"
"https://www.una.edu/math/bachelor-mathematics.html","https://www.una.edu/math/bachelor-mathematics.html","text/html; charset=UTF-8","200","OK","Indexable","","Bachelor of Arts/Bachelor of Science in Mathematics","51","469","","0","0","Become immersed in the foundational knowledge of mathematics with a Bachelor of Arts or a Bachelor of Science in Mathematics at the University of North Alabama.  Through this academic program, students will cover all aspects of applied and theoretical mathematics from world-class experts in the field and be challenged through a curriculum that seeks to enhance critical thinking and problem-solving.","401","2513","bachelor of science, bachelor of arts, mathematics,Bachelor,of,Arts/Bachelor,of,Science,in,Mathematics","102","University of North Alabama","27","Bachelor of Arts or Bachelor of Science in Mathematics","54","Why North Alabama?","18","Bachelor of Arts and Bachelor of Science in Mathematics Curriculum","66","","","","","https://www.una.edu/math/bachelor-mathematics.html","","","","","","","54481","13541","641","154","4.162","51.888","Fairly Hard","10.381","0","1","","9","1","0","1.090","137","101","0","26","21","0","","","","","d9bf312047317d26e80245741b508662","2.694","","","","","1.1","https://www.una.edu/math/bachelor-mathematics.html","2024-11-30 14:40:15"
"https://catalog.utexas.edu/undergraduate/natural-sciences/degrees-and-programs/bs-mathematics/","https://catalog.utexas.edu/undergraduate/natural-sciences/degrees-and-programs/bs-mathematics/","text/html; charset=UTF-8","200","OK","Indexable","","Bachelor of Science in Mathematics < The University of Texas at Austin","70","628","","0","0","","0","0","bachelor of science, bs math, mathematics, math","47","University Catalogs","19","Bachelor of Science in Mathematics","34","2024-25 Edition","15","Prescribed Work Common to All Options","37","","","","","","","","","","","","271530","271530","2076","418","4.967","72.449","Fairly Easy","19.741","0","4","","11","1","0","1.090","1666","1514","0","1","1","0","","","","","3879b05336335f1ae36b8b24cdded1d3","8.181","Wed, 21 Aug 2024 14:39:44 GMT","","","","1.1","https://catalog.utexas.edu/undergraduate/natural-sciences/degrees-and-programs/bs-mathematics/","2024-11-30 14:39:36"
"https://future.utsa.edu/programs/undergraduate/mathematics/","https://future.utsa.edu/programs/undergraduate/mathematics/","text/html; charset=UTF-8","200","OK","Indexable","","Bachelor's Degree in Mathematics | UTSA","39","366","","0","0","Our Math degree program will equip you to solve complex real world problems. Learn how The University of Texas at San Antonio can prepare you for the future.","157","988","","0","Mathematics Bachelor's Degree","29","","0","Start Your Bold Future","22","Why Pursue a Bachelor's Degree in Mathematics","45","index, follow, max-image-preview:large, max-snippet:-1, max-video-preview:-1","","","","https://future.utsa.edu/programs/undergraduate/mathematics/","","","","","","","109704","28622","1170","183","6.393","49.150","Hard","7.749","0","3","","4","1","0","1.090","60","49","0","13","13","0","","","","","5c65fd5f533e7a2e4cb2875d0893079","4.450","","","","","1.1","https://future.utsa.edu/programs/undergraduate/mathematics/","2024-11-30 14:41:37"
"https://catalog.gmu.edu/colleges-schools/science/mathematical-sciences/mathematics-bs/","https://catalog.gmu.edu/colleges-schools/science/mathematical-sciences/mathematics-bs/","text/html; charset=UTF-8","200","OK","Indexable","","Mathematics, BS < George Mason University","41","390","","0","0","","0","0","SC-BS-MATH, MATH, ACTM, Actuarial Mathematics, AMT, Applied Mathematics, MTHS, Mathematical Statistics, IND, Individualized Concentration, PURM, Pure Mathematics","161","Mathematics, BS","15","","0","Contact Information","19","Admissions","10","","","","","","","","","","","","122996","122996","4622","902","5.124","55.478","Fairly Hard","25.959","0","4","","21","1","0","1.090","401","190","0","6","6","0","","","","","6d4ff7285c6df71272653ef39da70cb4","3.992","Tue, 02 Jul 2024 22:02:29 GMT","","","","1.1","https://catalog.gmu.edu/colleges-schools/science/mathematical-sciences/mathematics-bs/","2024-11-30 14:40:56"
"https://guide.wisc.edu/undergraduate/letters-science/mathematics/mathematics-bs/","https://guide.wisc.edu/undergraduate/letters-science/mathematics/mathematics-bs/","text/html; charset=UTF-8","200","OK","Indexable","","Mathematics, BS < University of Wisconsin-Madison","49","457","","0","0","","0","0","Math","4","Guide","5","Mathematics, BS","15","How to Get in","13","University General Education Requirements","41","","","","","","","","","","","","167501","167501","4435","892","4.972","57.635","Fairly Hard","24.740","0","4","","24","1","0","1.090","334","201","0","8","8","0","","","","","c42140f98cc4b0dfc6bdd636e7e8e26c","6.483","Tue, 19 Nov 2024 16:17:33 GMT","","","","1.1","https://guide.wisc.edu/undergraduate/letters-science/mathematics/mathematics-bs/","2024-11-30 14:40:21"
"https://catalog.utep.edu/undergrad/college-of-science/mathematical-sciences/mathematics-bs/","https://catalog.utep.edu/undergrad/college-of-science/mathematical-sciences/mathematics-bs/","text/html; charset=UTF-8","200","OK","Indexable","","BS in Mathematics < UTEP","24","235","","0","0","","0","0","","0","Academic Catalog Toggle navigation Menu","39","Academic Catalog","16","2024-2025 Edition","17","THE UNIVERSITY OF TEXAS AT EL PASO","34","","","","","","","","","","","","296511","296511","7193","1799","3.998","78.611","Fairly Easy","15.029","0","4","","11","1","0","1.090","883","274","0","4","4","0","","","","","9331ae50a42ed585b469e0caf7bbe668","2.644","Tue, 26 Nov 2024 16:34:26 GMT","","","","1.1","https://catalog.utep.edu/undergrad/college-of-science/mathematical-sciences/mathematics-bs/","2024-11-30 14:38:49"
"https://www.bridgew.edu/academics/majors-minors-undergraduate/mathematics","https://www.bridgew.edu/academics/majors-minors-undergraduate/mathematics","text/html; charset=UTF-8","200","OK","Indexable","","Bachelor’s Degree in Mathematics | Bridgewater State University","63","567","","0","0","A bachelor's degree in mathematics sets a foundation of flexible analytical skills that launch careers in education or industry. Learn about our curriculum.","156","947","bachelor’s degree in mathematics, jobs in mathematics, best math undergraduate programs, careers with a math degree","115","Bachelor’s Degree in Mathematics","32","","0","BSU Works Menu Header","21","Count on Success: Pursue Rewarding Careers With a Math Degree","61","index, follow","","","","https://www.bridgew.edu/academics/majors-minors-undergraduate/mathematics","","","","","","","118649","21414","1208","185","6.530","52.648","Fairly Hard","8.901","0","2","","0","0","0","0.000","132","103","0","10","10","0","","","","","18f177d59ccecda69ec99765f88c24e4","7.277","Sat, 30 Nov 2024 09:39:27 GMT","","","","1.1","https://www.bridgew.edu/academics/majors-minors-undergraduate/mathematics","2024-11-30 14:39:24"
"https://www.fhsu.edu/macs/academic-programs/","https://www.fhsu.edu/macs/academic-programs/","text/html","200","OK","Indexable","","Mathematics Degrees -  Fort Hays State University (FHSU)","56","505","","0","0","When you major in mathematics at Fort Hays State University, you gain the analytical problem solving skills you need to make a difference in industry and academic settings.","172","1067","academic programs,mathematics,math","34","Academic Programs","17","","0","Choose the Field With Countless Career Applications","51","","0","","","","","https://www.fhsu.edu/macs/academic-programs/","","","","","","","26248","6009","308","41","7.512","44.843","Hard","10.924","0","2","","3","1","0","1.090","58","45","0","10","9","0","","","","","ce81a62975f7284ad3e475538c4bfecf","1.261","Sat, 30 Nov 2024 07:10:43 GMT","","","","1.1","https://www.fhsu.edu/macs/academic-programs/","2024-11-30 14:39:35"
"https://catalog.northeastern.edu/undergraduate/science/mathematics/mathematics-bs/","https://catalog.northeastern.edu/undergraduate/science/mathematics/mathematics-bs/","text/html; charset=UTF-8","200","OK","Indexable","","Mathematics, BS < Northeastern University Academic Catalog","58","545","","0","0","","0","0","BS-MATH","7","Mathematics, BS","15","","0","Academic Catalog 2024-2025","26","2024-2025 Edition","17","","","","","","","","","","","","62780","62780","938","202","4.644","94.884","Very Easy","12.636","0","4","","8","1","0","1.090","143","97","0","8","8","0","","","","","c8d05ad3cb0eddae3e2e8325db748406","3.521","Tue, 13 Aug 2024 18:35:54 GMT","","","","1.1","https://catalog.northeastern.edu/undergraduate/science/mathematics/mathematics-bs/","2024-11-30 14:39:27"
"https://mathematics.jhu.edu/undergraduate/requirements/","https://mathematics.jhu.edu/undergraduate/requirements/","text/html; charset=UTF-8","200","OK","Indexable","","Major and Minor Requirements | Mathematics | Johns Hopkins University","69","641","","0","0","Students who entered Johns Hopkins in the current academic year should refer to the current Academic Catalog for a current list of major and minor requirements. Students who entered Johns Hopkins University in a previous academic year should refer to the catalog of that academic year. This page includes more detailed major requirements and minor requirements. Major Requirements...","383","2422","","0","Department of Mathematics","25","Major and Minor Requirements","28","Major Requirements","18","Minor Requirements","18","max-image-preview:large","","","","","","","","","","","124784","30461","1093","254","4.303","58.191","Fairly Hard","13.370","0","2","","6","1","0","1.090","111","51","0","8","8","0","","","","","1c023ec39d88c4de235e21d070a86f33","2.146","Fri, 29 Nov 2024 15:38:33 GMT","","","","1.1","https://mathematics.jhu.edu/undergraduate/requirements/","2024-11-30 14:38:49"
"https://catalog.utdallas.edu/2022/undergraduate/programs/nsm/mathematics","https://catalog.utdallas.edu/2022/undergraduate/programs/nsm/mathematics","text/html; charset=UTF-8","200","OK","Indexable","","Mathematics (BA, BS) - UT Dallas 2022 Undergraduate Catalog - The University of Texas at Dallas","95","853","","0","0","UT Dallas 2022 Undergraduate Catalog","36","242","UT Dallas 2022 Undergraduate Catalog University of Texas at Dallas UT Dallas","76","School of Natural Sciences and Mathematics","42","","0","Mathematics (BA, BS)","20","Bachelor of Arts in Mathematics","31","","","","","","","","","","","","221114","29293","2921","502","5.819","54.233","Fairly Hard","12.958","0","4","","108","1","0","1.090","528","229","0","1","1","0","","","","","680d7540e472600141224dabdee80e1f","5.683","","","","","1.1","https://catalog.utdallas.edu/2022/undergraduate/programs/nsm/mathematics","2024-11-30 14:39:09"
"https://www.boisestate.edu/coas-advising/degree-plans/math/bs-math/","https://www.boisestate.edu/coas-advising/degree-plans/math/bs-math/","text/html; charset=UTF-8","200","OK","Indexable","","Bachelor of Science in Mathematics, BS - COAS Academic Advising and Student Services","84","787","","0","0","","0","0","","0","Bachelor of Science in Mathematics, BS","38","","0","Boise Global Navigation","23","COAS Academic Advising and Student Services","43","index, follow, max-image-preview:large, max-snippet:-1, max-video-preview:-1","","","","https://www.boisestate.edu/coas-advising/degree-plans/math/bs-math/","","","","","","","175557","42641","581","138","4.210","68.308","Normal","2.568","0","4","","2","1","0","1.090","35","30","0","10","10","0","","","","","9f62a44daf70effced4581478e98d036","2.044","","","","","1.1","https://www.boisestate.edu/coas-advising/degree-plans/math/bs-math/","2024-11-30 14:39:22"
"https://www.wgu.edu/online-teaching-degrees/mathematics-teacher-certification-secondary-bachelors-program.html","https://www.wgu.edu/online-teaching-degrees/mathematics-teacher-certification-secondary-bachelors-program.html","text/html;charset=utf-8","200","OK","Indexable","","High/Middle School Math Teacher Certification Bachelor's Degree | WGU","69","639","","0","0","Earn your math teacher certification at home with WGU’s accredited online Bachelor of Science in Mathematics Education (Secondary) with teaching licensure.","155","981","B.S. Math Education (Secondary)","31","Mathematics Education Degree (Secondary)","40","","0","The Online Math Degree You Need to Make a Difference for Students","65","Secondary Mathematics Education Courses","39","","","","","https://www.wgu.edu/online-teaching-degrees/mathematics-teacher-certification-secondary-bachelors-program.html","","","","","","","511808","511808","10693","1993","5.365","47.237","Hard","14.330","0","1","","16","1","0","1.090","490","198","0","7","7","0","","","","","d07d6f0db490d99b6814f2cdadbdafe5","1.109","Wed, 24 Apr 2024 15:58:53 GMT","","","","1.1","https://www.wgu.edu/online-teaching-degrees/mathematics-teacher-certification-secondary-bachelors-program.html","2024-11-30 14:41:23"
"https://reg.msu.edu/academicprograms/ProgramDetail.aspx?Program=MATHEM_BS1","https://reg.msu.edu/academicprograms/ProgramDetail.aspx?Program=MATHEM_BS1","text/html; charset=utf-8","200","OK","Indexable","","MSU RO:
    Academic Programs:Mathematics - Bachelor of Science","64","575","","0","0","","0","0","","0","Undergraduate Degree","20","","0","Mathematics - Bachelor of Science","33","Other Links","11","","","","","","","","","","","","97549","37026","1098","187","5.872","72.974","Fairly Easy","9.206","0","1","","2","1","0","1.090","99","87","0","0","0","0","","","","","41d121f991597c6b272c7b231e2bbff1","3.219","","","","","1.1","https://reg.msu.edu/academicprograms/ProgramDetail.aspx?Program=MATHEM_BS1","2024-11-30 14:39:47"
"https://www.umsl.edu/degrees/bachelors/mathematics.html","https://www.umsl.edu/degrees/bachelors/mathematics.html","text/html","200","OK","Indexable","","Mathematics Degree | UMSL","25","251","","0","0","Think analytically to solve problems in many industries with UMSL's BA or BS in Mathematics. Gain a broad academic understanding to pursue graduate studies.","156","993","mathematics, bachelors, bs, degree, majors, umsl, stl, st. louis, education, college, math","90","Mathematics","11","$113,990","8","Gain sought-after skills for diverse careers with a mathematics degree","70","Why earn your bachelor’s in math at UMSL?","41","","","","","","","","","","","","61970","16704","1598","263","6.076","49.044","Hard","18.482","0","2","","11","1","0","1.090","101","49","0","11","10","0","","","","","cc491d139b5be0f9a3ad58d079a4993","3.455","Wed, 11 Sep 2024 18:07:01 GMT","","","","1.1","https://www.umsl.edu/degrees/bachelors/mathematics.html","2024-11-30 14:40:09"
"https://www.kennesaw.edu/degrees-programs/bachelor-degrees/mathematics.php","https://www.kennesaw.edu/degrees-programs/bachelor-degrees/mathematics.php","text/html; charset=UTF-8","200","OK","Indexable","","Bachelor of Science in Mathematics - Kennesaw State University","62","569","","0","0","A Math Degree at Kennesaw State provides the training you need for a career in fields such as technology, engineering, science, and other industries.","149","919","","0","Bachelor of Science in Mathematics","34","","0","Bachelor of Science in Mathematics","34","","0","","","","","https://www.kennesaw.edu/degrees-programs/bachelor-degrees/mathematics.php","","","","","","","49998","49998","957","221","4.330","53.395","Fairly Hard","12.861","0","2","","8","1","0","1.090","84","59","0","13","13","0","","","","","8294d73ef9b088eba11afe404aa5f638","1.789","","","","","1.1","https://www.kennesaw.edu/degrees-programs/bachelor-degrees/mathematics.php","2024-11-30 14:39:08"
"https://catalog.csusb.edu/colleges-schools-departments/natural-sciences/mathematics/mathematics-bs/","https://catalog.csusb.edu/colleges-schools-departments/natural-sciences/mathematics/mathematics-bs/","text/html; charset=UTF-8","200","OK","Indexable","","Bachelor of Science in Mathematics | CSUSB","42","395","","0","0","","0","0","","0","2024-25 Catalog","15","Bachelor of Science in Mathematics","34","Requirements for the B.S. in Mathematics","40","Concentrations (26-36 Units)","28","","","","","","","","","","","","74454","74454","1216","274","4.438","71.256","Fairly Easy","17.310","0","4","","3","1","0","1.090","243","176","0","10","10","0","","","","","c6b90a358cf1e7780e103b7b742912ed","2.471","Thu, 09 May 2024 21:10:59 GMT","","","","1.1","https://catalog.csusb.edu/colleges-schools-departments/natural-sciences/mathematics/mathematics-bs/","2024-11-30 14:41:05"
"https://www.csusm.edu/math/bsdegree/index.html","https://www.csusm.edu/math/bsdegree/index.html","text/html; charset=UTF-8","200","OK","Indexable","","Bachelor of Science in Mathematics | Mathematics | CSUSM","56","531","","0","0","","0","0","","0","Bachelor of Science in Mathematics","34","","0","","0","","0","","","","","https://www.csusm.edu/math/bsdegree/index.html","","","","","","","26693","26693","618","100","6.180","67.776","Normal","18.724","0","2","","12","1","0","1.090","85","40","0","4","2","0","","","","","46b79e2f10f402fab95bf4654d539c7d","2.340","","","","","1.1","https://www.csusm.edu/math/bsdegree/index.html","2024-11-30 14:39:19"
"https://catalog.slu.edu/colleges-schools/arts-sciences/mathematics-statistics/mathematics-bs/","https://catalog.slu.edu/colleges-schools/arts-sciences/mathematics-statistics/mathematics-bs/","text/html; charset=UTF-8","200","OK","Indexable","","Mathematics, B.S. < Saint Louis University","42","369","","0","0","","0","0","","0","Mathematics, B.S.","17","","0","Why Saint Louis University","26","Program Highlights","18","","","","","","","","","","","","240836","240836","2708","491","5.515","52.625","Fairly Hard","25.788","0","4","","14","1","0","1.090","1268","1203","0","7","7","0","","","","","9f2cdfcb00c9c8a94fa5493790a3d9bd","1.968","Wed, 20 Nov 2024 16:38:33 GMT","","","","1.1","https://catalog.slu.edu/colleges-schools/arts-sciences/mathematics-statistics/mathematics-bs/","2024-11-30 14:39:43"
"https://www.nsu.edu/Academics/Faculty-and-Academic-Divisions/Schools-and-Colleges/College-of-Science-Engineering-and-Technology/Departments/Mathematics/Programs/Bachelor-of-Science-in-Mathematics","https://www.nsu.edu/Academics/Faculty-and-Academic-Divisions/Schools-and-Colleges/College-of-Science-Engineering-and-Technology/Departments/Mathematics/Programs/Bachelor-of-Science-in-Mathematics","text/html; charset=utf-8","200","OK","Indexable","","Bachelor of Science in Mathematics | NSU - Norfolk State University","67","593","","0","0","Earn your Bachelor of Science in Mathematics at Norfolk State University and learn the quantitative skills necessary for success in various disciplines.","152","925","mathematics degree, mathematics major, bachelor of science in mathematics, bachelor’s in mathematics, what jobs can you get with a mathematics degree","149","B.S. Mathematics","16","","0","Menu","4","A mathematics degree designed with you in mind","46","","","","","","","","","","","","613055","613055","881","152","5.796","50.861","Fairly Hard","5.594","0","7","","2","1","0","1.090","1651","1594","0","10","10","0","","","","","2de15e7aca2cbdeec5858b8519a5f418","8.503","","","","","1.1","https://www.nsu.edu/Academics/Faculty-and-Academic-Divisions/Schools-and-Colleges/College-of-Science-Engineering-and-Technology/Departments/Mathematics/Programs/Bachelor-of-Science-in-Mathematics","2024-11-30 14:40:56"
