"https://www.nbcnews.com/news/gentle-parenting-style-hard-on-parents-rcna176917","https://www.nbcnews.com/news/gentle-parenting-style-hard-on-parents-rcna176917","text/html; charset=utf-8","200","OK","Indexable","","Gentle parenting is proving too rough for many parents","54","483","A study published in July found that over 40% of self-identified gentle parents teeter toward burnout and self-doubt because of the pressure to meet parenting standards.","169","1049","","0","0","","0","Why gentle parenting is proving too rough for many parents","58","","0","Culture of comparison","21","What parenting style could take gentle parenting’s place?","57","max-image-preview:large","","","","https://www.nbcnews.com/news/gentle-parenting-style-hard-on-parents-rcna176917","","","","","","","319809","78083","1753","239","7.335","65.082","Normal","4.357","0","1","","0","0","0","0.000","87","51","0","45","41","0","","","","","54c095794d9802c23a6ca838ee2f3197","1.327","","","","","1.1","https://www.nbcnews.com/news/gentle-parenting-style-hard-on-parents-rcna176917","2024-11-30 15:20:50"
"https://health.ucdavis.edu/children/patient-education/Positive-Parenting","https://health.ucdavis.edu/children/patient-education/Positive-Parenting","text/html;charset=UTF-8","200","OK","Indexable","","The Power of Positive Parenting | Patient and Family Education | UC Davis Children Hospital","91","806","The Power of Positive Parenting with PRIDE Skills: Praise, Reflection, Imitation, Description and Enjoyment.","108","659","","0","0","Positive Parenting, PRIDE Skills, Praise, Reflection, Imitation, Description, Enjoyment, Playtime","97","The Power of Positive Parenting | Patient and Family Education | UC Davis Children Hospital","91","","0","The power of positive parenting","31","What is positive parenting and why is it powerful?","50","","","","","","","","","","","","61770","15273","1886","377","5.003","75.530","Fairly Easy","23.468","0","2","","1","1","0","1.270","80","49","0","15","15","0","","","","","f56cf394eb0299505377c284929ce521","1.540","","","","","1.1","https://health.ucdavis.edu/children/patient-education/Positive-Parenting","2024-11-30 15:20:26"
"https://www.catholic.edu/about/initiatives/parenting-catholic-university","https://www.catholic.edu/about/initiatives/parenting-catholic-university","text/html; charset=UTF-8","200","OK","Indexable","","Parenting at Catholic University | Catholic University","54","456","We offer pregnancy and parenting support for our campus community, in particular guided by The Guadalupe Project at Catholic University.","136","861","","0","0","","0","Parenting at Catholic University","32","","0","Let Us Help","11","We offer pregnancy and parenting support for our campus community, in particular guided by The Guadalupe Project at Catholic University.","136","","","","","https://www.catholic.edu/about/initiatives/parenting-catholic-university","","","","","","","201603","58137","391","64","6.109","56.749","Fairly Hard","9.310","0","2","","8","1","0","1.270","135","93","0","8","6","0","","","","","3674f11b35fbe8e9ba385041fe8d0c71","1.536","Sat, 30 Nov 2024 10:20:17 GMT","","","","1.1","https://www.catholic.edu/about/initiatives/parenting-catholic-university","2024-11-30 15:20:17"
"https://courts.alaska.gov/shc/family/shcplan.htm","https://courts.alaska.gov/shc/family/shcplan.htm","text/html","200","OK","Indexable","","Request Rejected","16","155","","0","0","","0","0","","0","","0","","0","","0","","0","","","","","","","","","","","","245","245","18","5","3.600","90.381","Very Easy","48.627","0","2","","0","0","0","0.000","0","0","0","0","0","0","","","","","a507453d767be6741defc634449fefec","1.417","","","","","1.1","https://courts.alaska.gov/shc/family/shcplan.htm","2024-11-30 15:20:26"
"https://www.positiveparenting.com/","https://www.positiveparenting.com/","text/html; charset=UTF-8","200","OK","Indexable","","Positive Parenting - Positive Parenting","39","337","Positive Parenting is dedicated to providing resources and information that make parenting more rewarding, effective and fun.","125","779","","0","0","","0","","0","","0","Positive Parenting is dedicated to providing resources and information that make parenting more rewarding, effective and fun.","125","Web Site","8","index, follow, max-image-preview:large, max-snippet:-1, max-video-preview:-1","index,follow","","","https://www.positiveparenting.com/","","","","","","","115734","31766","551","89","6.191","65.437","Normal","2.955","0","0","","7","1","0","1.270","9","3","0","3","3","0","","","","","1a0790608ed23c75be926baa18ec5a0e","1.388","Sat, 30 Nov 2024 10:01:21 GMT","","","","1.1","https://www.positiveparenting.com/","2024-11-30 15:20:23"
"https://www.ncbi.nlm.nih.gov/books/NBK568743/","https://www.ncbi.nlm.nih.gov/books/NBK568743/","text/html; charset=iso-8859-1","302","Found","Non-Indexable","Redirected","","0","0","","0","0","","0","0","","0","","0","","0","","0","","0","","","","","","","","","","","","233","233","0","","","","","0.000","0","2","","0","0","0","0.000","0","0","0","0","0","0","","","","","","0.980","","https://misuse.ncbi.nlm.nih.gov/error/abuse.shtml","HTTP Redirect","","1.1","https://www.ncbi.nlm.nih.gov/books/NBK568743/","2024-11-30 15:21:01"
"https://www.theatlantic.com/ideas/archive/2019/05/normalize-parenthood-workplace-dont-hide-it/589822/","https://www.theatlantic.com/ideas/archive/2019/05/normalize-parenthood-workplace-dont-hide-it/589822/","text/html; charset=utf-8","200","OK","Indexable","","To Normalize Parenthood in the Workplace, Don't Hide It - The Atlantic","70","618","If mothers and fathers speak openly about child-care obligations, their colleagues will adapt.","94","571","","0","0","children’s health, little kids, evidence of their children, parental leave, secret parenting, child-related issue, senior colleagues, first impulse, mothers of small children.The women, women professors, first child, team of men, phone call, Child care, pretend kids, parents, best-laid child-care plans, labor force, baseball games, small children, women, time constraints, general sense, policy.But experience, personal experience, assistant professor, junior colleagues, fix problems, school plays, work, sick day, issue of secrecy, parent-teacher conferences, main driver of the gender gap, political level, gender-neutral, evidence show, pictures of their children, issues, none of the men, office, woman, Alexandria Ocasio-Cortez, work side, third trimester, climate issues, new book, kids, first meeting, data","816","End the Plague of Secret Parenting","34","","0","Site Navigation","15","Sections","8","index, follow, max-image-preview:large","","","","https://www.theatlantic.com/ideas/archive/2019/05/normalize-parenthood-workplace-dont-hide-it/589822/","","","","","","","122216","29912","1445","201","7.189","77.819","Fairly Easy","10.370","0","6","","1","1","0","1.270","62","49","0","7","7","0","","","","","6353bf247b0e53d74ee9bbe902b8cfb8","0.678","","","","","1.1","https://www.theatlantic.com/ideas/archive/2019/05/normalize-parenthood-workplace-dont-hide-it/589822/","2024-11-30 15:20:42"
"https://ccejefferson.org/parenting","https://ccejefferson.org/parenting","text/html; charset=utf-8","200","OK","Indexable","","Cornell Cooperative Extension  | Parenting","42","367","Our children are the
foundation of our society. How we parent is a driving force shaping our
children as they grow into productive adults. Parenting is not intuitive and
babies do not come with manuals. Indeed, each child is unique and sometimes
this can create challenges in and opportunit...","297","1802","","0","0","","0","Cornell Cooperative Extension","29","Cornell Cooperative Extension","29","Jefferson County","16","Jefferson County","16","","","","","","","","","","","","27904","27904","685","179","3.827","68.579","Normal","15.374","0","0","","2","1","0","1.270","63","34","0","30","28","0","","","","","ec3688f1ec21f0f11b5ea28c367371f0","1.985","","","","","1.1","https://ccejefferson.org/parenting","2024-11-30 15:20:38"
"https://www.theparentingplace.net/","https://www.theparentingplace.net/","text/html; charset=UTF-8","200","OK","Indexable","","Home - The Parenting Place","26","247","For grownups who care about kids. Non-profit services FREE for any parent or caregiver!","87","545","","0","0","","0","FREE Parenting Classes","22","","0","Parent or Child Care Provider","29","We are here to support you every step of the way.","49","index, follow, max-image-preview:large, max-snippet:-1, max-video-preview:-1","","","","https://www.theparentingplace.net/","","","","","","","125086","23772","497","117","4.248","81.496","Easy","2.578","0","0","","9","1","0","1.270","60","30","0","3","3","0","","","","","c8b6502fb0914886f6e229e5ac9d0767","1.816","Fri, 29 Nov 2024 23:44:56 GMT","","","","1.1","https://www.theparentingplace.net/","2024-11-30 15:20:49"
"https://pediatrics.jmir.org/","https://pediatrics.jmir.org/","text/html; charset=utf-8","200","OK","Indexable","","JMIR Pediatrics and Parenting","29","268","","0","0","","0","0","","0","JMIR Pediatrics and Parenting","29","","0","Recent Articles","15","Preprints Open for Peer-Review","30","","","","","","","","","","","","349219","54244","1321","203","6.507","29.301","Very Hard","3.708","0","0","","20","1","0","1.270","179","105","0","38","33","0","","","","","53f9bf8260c5264b67f5e95014620689","1.054","","","","","1.1","https://pediatrics.jmir.org/","2024-11-30 15:20:24"
"https://witsendparenting.com/","https://witsendparenting.com/","text/html; charset=UTF-8","200","OK","Indexable","","San Francisco Bay Area Family Therapist - Wit’s End Parenting","61","548","Is your child spirited, strong-willed, oppositional or defiant? We solve kids' problem behavior when other parenting experts and therapists can't!","146","882","","0","0","","0","","0","","0","Are you feeling stressed, frustrated, or overwhelmed by your child’s behavior?","78","Is your child strong-willed, demand-avoidant, oppositional or defiant?","70","index, follow, max-image-preview:large, max-snippet:-1, max-video-preview:-1","","","","https://witsendparenting.com/","","","","","","","318198","50007","1178","155","7.600","76.171","Fairly Easy","2.340","0","0","","7","1","0","1.270","45","15","0","1","1","0","","","","","c9182652934f0fce47663d5eb6862dec","1.546","Sat, 30 Nov 2024 03:41:21 GMT","","","","1.1","https://witsendparenting.com/","2024-11-30 15:20:54"
"https://nap.nationalacademies.org/catalog/21868/parenting-matters-supporting-parents-of-children-ages-0-8","https://nap.nationalacademies.org/catalog/21868/parenting-matters-supporting-parents-of-children-ages-0-8","text/html; charset=UTF-8","200","OK","Indexable","","Parenting Matters: Supporting Parents of Children Ages 0-8 | The National Academies Press","89","809","Read online, download a free PDF, or order a copy in print or as an eBook.","74","452","","0","0","","0","Parenting Matters","17","RESOURCES AT A GLANCE","21","Supporting Parents of Children Ages 0-8","39","","0","","","","","https://nap.nationalacademies.org/catalog/21868/parenting-matters-supporting-parents-of-children-ages-0-8","","","","","","","212041","212041","1685","344","4.898","56.964","Fairly Hard","10.796","0","2","","4","1","0","1.270","205","138","0","13","11","0","","","","","883b7a5ddbe24cab3181ca9a98863cc9","1.493","Mon, 18 Mar 2024 12:13:48 EDT","","","","1.1","https://nap.nationalacademies.org/catalog/21868/parenting-matters-supporting-parents-of-children-ages-0-8","2024-11-30 15:20:49"
"https://www.unicef.org/parenting/","https://www.unicef.org/parenting/","text/html; charset=UTF-8","200","OK","Indexable","","UNICEF Parenting | UNICEF Parenting","35","331","Helping parents give children the best start in life.","53","307","","0","0","","0","UNICEF Parenting","16","","0","Spotlight","9","Developmental milestones","24","","","","","https://www.unicef.org/parenting/","","","","","","","114310","19166","513","110","4.664","78.582","Fairly Easy","3.540","0","1","","5","1","0","1.270","87","44","0","4","3","0","","","","","b9401246cffa57d318f35b334c523b9b","1.432","Sat, 30 Nov 2024 09:41:15 GMT","","","","1.1","https://www.unicef.org/parenting/","2024-11-30 15:20:47"
"https://kidshealth.org/en/parents/nine-steps.html","https://kidshealth.org/en/parents/nine-steps.html","","302","Object Moved","Non-Indexable","Redirected","","0","0","","0","0","","0","0","","0","","0","","0","","0","","0","","","","","","","","","","","","0","0","0","","","","","0.000","0","2","","2","2","0","2.530","0","0","0","0","0","0","","","","","","1.022","","https://kidshealth.org/","HTTP Redirect","","1.1","https://kidshealth.org/en/parents/nine-steps.html","2024-11-30 15:20:54"
"https://www.merriam-webster.com/dictionary/parenting","https://www.merriam-webster.com/dictionary/parenting","text/html; charset=utf-8","200","OK","Indexable","","Parenting Definition & Meaning - Merriam-Webster","48","443","The meaning of PARENTING is the raising of a child by its parents. How to use parenting in a sentence.","102","638","","0","0","","0","parenting","9","","0","noun","4","Synonyms","8","","","","","https://www.merriam-webster.com/dictionary/parenting","","","","","","","690694","110103","635","161","3.944","73.600","Fairly Easy","0.663","0","1","","26","1","0","1.270","100","51","0","9","8","0","","","","","578274170769a98eab8b88298742c7e3","1.079","","","","","1.1","https://www.merriam-webster.com/dictionary/parenting","2024-11-30 15:20:37"
"https://www.linnbenton.edu/parenting-programs/","https://www.linnbenton.edu/parenting-programs/","text/html; charset=UTF-8","200","OK","Non-Indexable","Redirected","Redirect Page","13","123","","0","0","","0","0","","0","","0","","0","","0","","0","","","","0; URL=/educational-options/community-and-continuing-education/family-resources/parenting-programs/index.php","","","","","","","","766","452","12","2","6.000","45.645","Hard","9.449","0","1","","0","0","0","0.000","1","1","0","1","1","0","","","","","96320c24595bc0a32ddddd540954abc6","1.027","","https://www.linnbenton.edu/educational-options/community-and-continuing-education/family-resources/parenting-programs/index.php","Meta Refresh Redirect","","1.1","https://www.linnbenton.edu/parenting-programs/","2024-11-30 15:20:26"
"https://www.wake.gov/departments-government/health-human-services/children-and-family-services/foster-care-permanency-planning-adoption-services/shared-parenting","https://www.wake.gov/departments-government/health-human-services/children-and-family-services/foster-care-permanency-planning-adoption-services/shared-parenting","text/html; charset=UTF-8","200","OK","Indexable","","Shared Parenting | Wake County Government","41","399","Information about shared parenting between the foster parent and birth family. Abuse, neglect, child protection, dependency, child safety, child laws, infant surrender, safe surrender, substance affected infants, foster care, adoption","234","1421","","0","0","","0","Wake County, NC","15","Shared Parenting","16","Foster Care (Permanency Planning) & Adoption Services","53","I want to...","12","","","","","https://www.wake.gov/departments-government/health-human-services/children-and-family-services/foster-care-permanency-planning-adoption-services/shared-parenting","","","","","","","57899","14639","492","91","5.407","78.574","Fairly Easy","9.649","0","4","","6","1","0","1.270","97","82","0","10","5","0","","","","","7265f0ee865d46bd12004f76f69d4f9d","1.055","Fri, 29 Nov 2024 19:22:51 GMT","","","","1.1","https://www.wake.gov/departments-government/health-human-services/children-and-family-services/foster-care-permanency-planning-adoption-services/shared-parenting","2024-11-30 15:20:29"
"https://www.mdcourts.gov/family/parentingplans","https://www.mdcourts.gov/family/parentingplans","text/html; charset=UTF-8","200","OK","Non-Indexable","Canonicalised","Parenting Plans | Maryland Courts","33","300","","0","0","","0","0","","0","Parenting Plans","15","","0","Colors","6","Text Size","9","","","","","http://www.mdcourts.gov/family/parentingplans","","","","","","","77610","17384","1099","235","4.677","73.687","Fairly Easy","12.437","0","1","","3","1","0","1.270","318","148","0","14","9","0","","","","","281723bb96864ffbb23044bfd3328ffd","1.645","Sat, 30 Nov 2024 10:20:14 GMT","","","","1.1","https://www.mdcourts.gov/family/parentingplans","2024-11-30 15:20:14"
"https://nebraskalegislature.gov/laws/statutes.php?statute=43-2928","https://nebraskalegislature.gov/laws/statutes.php?statute=43-2928","","0","Connection Timeout","Non-Indexable","No Response","","0","0","","0","0","","0","0","","0","","0","","0","","0","","0","","","","","","","","","","","","0","0","0","","","","","0.000","0","1","","0","0","0","0.000","0","0","0","0","0","0","","","","","","","","","","","","https://nebraskalegislature.gov/laws/statutes.php?statute=43-2928","2024-11-30 15:21:04"
"https://www.supremecourt.ohio.gov/JCS/CFC/DRForms/Form20.pdf","https://www.supremecourt.ohio.gov/JCS/CFC/DRForms/Form20.pdf","","0","Connection Timeout","Non-Indexable","No Response","","0","0","","0","0","","0","0","","0","","0","","0","","0","","0","","","","","","","","","","","","0","0","0","","","","","0.000","0","3","","0","0","0","0.000","0","0","0","0","0","0","","","","","","","","","","","","https://www.supremecourt.ohio.gov/JCS/CFC/DRForms/Form20.pdf","2024-11-30 15:20:27"
"https://www.courts.nh.gov/sites/g/files/ehbemt471/files/documents/2021-04/nhjb-2061-f.pdf","https://www.courts.nh.gov/sites/g/files/ehbemt471/files/documents/2021-04/nhjb-2061-f.pdf","application/pdf","200","OK","Indexable","","Parenting Petition","18","159","","0","0","","0","0","Petition to be used by a party, usually unmarried, seeking to establish parental rights and responsibilities.","109","","0","","0","","0","","0","","","","","","","","","","","","52311","52311","0","","","","","0.000","0","7","","0","0","0","0.000","0","0","0","0","0","0","","","","","","1.669","Tue, 03 Jan 2023 13:43:44 GMT","","","","1.1","https://www.courts.nh.gov/sites/g/files/ehbemt471/files/documents/2021-04/nhjb-2061-f.pdf","2024-11-30 15:20:20"
"https://www.in.gov/courts/rules/parenting/","https://www.in.gov/courts/rules/parenting/","text/html; charset=UTF-8","200","OK","Indexable","","Indiana Parenting Time Guidelines","33","303","","0","0","","0","0","","0","RULE","4","GUIDELINES","10","PARENTING TIME RULE. ADOPTION OF PARENTING TIME RULE AND GUIDELINES","67","PREAMBLE","8","","","","","","","","","","","","387155","54798","17640","2575","6.850","66.464","Normal","27.798","0","3","","33","1","0","1.270","34","2","0","0","0","0","","","","","4bf1daa5453f82b5dd20bd0272452160","1.052","","","","","1.1","https://www.in.gov/courts/rules/parenting/","2024-11-30 15:20:56"
"https://sunshine-parenting.com/","https://sunshine-parenting.com/","text/html; charset=UTF-8","200","OK","Indexable","","Home | Sunshine Parenting","25","241","Discover parenting tips that can help raise happy, healthy, independent, responsible kids through the power of camping experiences.","131","819","","0","0","","0","Home","4","","0","Why Summer Camp May be the Secret to a Longer Life","50","[ENCORE] Ep. 52: 9 Ways to Help Kids Process Summer Camp and Other Experiences","78","index, follow, max-image-preview:large, max-snippet:-1, max-video-preview:-1","","","","https://sunshine-parenting.com/","","","","","","","119070","21506","288","62","4.645","84.914","Easy","1.609","0","0","","1","1","0","1.270","42","26","0","1","1","0","","","","","e753e47e290930fd696b74ca59405523","1.275","","","","","1.1","https://sunshine-parenting.com/","2024-11-30 15:20:55"
"https://store.paultripp.com/collections/parenting-14-gospel-principles-that-can-radically-change-your-family","https://store.paultripp.com/collections/parenting-14-gospel-principles-that-can-radically-change-your-family","text/html; charset=utf-8","200","OK","Indexable","","Parenting: 14 Gospel Principles That Can Radically Change Your Family - PaulTripp.com - Paul David Tripp
– Paul Tripp Ministries, Inc.","134","1176","Winner of the ECPA Book of the Year Award for Christian Living - Over 100,000 Copies in Print What is your calling as a parent? In the midst of folding laundry, coordinating carpool schedules, and breaking up fights, many parents get lost. Feeling pressure to do everything “right” and raise up “good” children, it’s eas","320","1942","","0","0","","0","Parenting: 14 Gospel Principles That Can Radically Change Your Family","69","","0","","0","","0","","","","","https://store.paultripp.com/collections/parenting-14-gospel-principles-that-can-radically-change-your-family","","","","","","","129474","25799","610","173","3.526","83.013","Easy","3.464","0","1","","3","1","0","1.270","115","57","0","9","3","0","","","","","8dd0fbbef7bf8ff79933d70832413c83","0.870","","","","","1.1","https://store.paultripp.com/collections/parenting-14-gospel-principles-that-can-radically-change-your-family","2024-11-30 15:20:48"
"https://www.ted.com/topics/parenting","https://www.ted.com/topics/parenting","","307","Temporary Redirect","Non-Indexable","Redirected","","0","0","","0","0","","0","0","","0","","0","","0","","0","","0","","","","","","","","","","","","19","19","0","","","","","0.000","0","1","","0","0","0","0.000","0","0","0","0","0","0","","","","","","0.680","","https://www.ted.com/search?q=parenting","HTTP Redirect","","1.1","https://www.ted.com/topics/parenting","2024-11-30 15:20:25"
"https://www.tncourts.gov/programs/parenting-plan","https://www.tncourts.gov/programs/parenting-plan","text/html; charset=UTF-8","200","OK","Indexable","","Parenting Plan | Tennessee Administrative Office of the Courts","62","553","","0","0","","0","0","","0","Parenting Plan","14","","0","TOP MAIN NAVIGATION","19","Programs","8","","","","","https://www.tncourts.gov/programs/parenting-plan","","","","","","","38410","8901","220","41","5.366","71.028","Fairly Easy","7.469","0","1","","4","1","0","1.270","79","62","0","4","4","0","","","","","e6571624f39da39bc1c03608cd8ebd66","1.609","Sat, 30 Nov 2024 07:30:47 GMT","","","","1.1","https://www.tncourts.gov/programs/parenting-plan","2024-11-30 15:20:55"
"https://podcasts.apple.com/us/podcast/the-aware-parenting-podcast/id1455772681","https://podcasts.apple.com/us/podcast/the-aware-parenting-podcast/id1455772681","text/html","200","OK","Indexable","","The Aware Parenting Podcast Podcast - Apple Podcasts","52","496","Listen to Marion Rose, PhD.'s The Aware Parenting Podcast podcast on Apple Podcasts.","84","548","","0","0","","0","The Aware Parenting Podcast","27","","0","Episodes","8","Ratings & Reviews","17","","","","","https://podcasts.apple.com/us/podcast/the-aware-parenting-podcast/id1455772681","","","","","","","546169","57877","3103","770","4.030","74.004","Fairly Easy","4.257","0","3","","0","0","0","0.000","398","213","0","1","1","0","","","","","602b5bcfe7671dcf024afae83d4ad455","1.035","","","","","1.1","https://podcasts.apple.com/us/podcast/the-aware-parenting-podcast/id1455772681","2024-11-30 15:20:21"
"https://www.cdc.gov/parenting-toddlers/about/index.html","https://www.cdc.gov/parenting-toddlers/about/index.html","text/html","200","OK","Indexable","","Essentials for Parenting Toddlers and Preschoolers | Essentials for Parenting Toddlers | CDC","92","813","A free online resource for parents and caregivers of children between the ages of two and four.","95","586","","0","0","","0","Essentials for Parenting Toddlers and Preschoolers","50","","0","Key points","10","Overview","8","index, archive","","","","https://www.cdc.gov/parenting-toddlers/about/index.html","","","","","","","50372","9879","765","148","5.169","58.819","Fairly Hard","11.654","0","2","","36","1","0","1.270","149","31","0","17","15","0","","","","","c1dee862a008c39a36f339d0241d8674","0.799","","","","","1.1","https://www.cdc.gov/parenting-toddlers/about/index.html","2024-11-30 15:20:39"
"https://www.psychologytoday.com/us/basics/parenting","https://www.psychologytoday.com/us/basics/parenting","text/html; charset=UTF-8","200","OK","Indexable","","Parenting | Psychology Today","28","261","From encouraging schoolwork and sports to modeling values as a child grows (remember, they do as you do, not as you say!) parents exert enormous influence over their children's lives. They are, however, not the only on-the-ground influencers—especially after children enter school and begin interacting with the world at large.","327","2023","","0","0","","0","A Parent's Role","15","","0","","0","","0","index,follow","","","","https://www.psychologytoday.com/us/basics/parenting","","","","","","","119475","21818","1709","336","5.086","64.204","Normal","10.235","0","2","","18","1","0","1.270","263","150","0","4","4","0","","","","","e39ed061a1e6cf140b12197a7b446e95","0.752","Fri, 29 Nov 2024 17:29:06 GMT","","","","1.1","https://www.psychologytoday.com/us/basics/parenting","2024-11-30 15:20:53"
"https://www.pennilessparenting.com/","https://www.pennilessparenting.com/","text/html; charset=UTF-8","200","OK","Indexable","","Penniless Parenting","19","177","","0","0","","0","0","","0","Penniless Parenting","19","","0","Getting Myself Custom Orthotics- Finally","40","Salvaging Accidentally Frozen Foods","35","","","","","https://www.pennilessparenting.com/","","","","","","","193594","40851","385","116","3.319","80.412","Easy","1.206","0","0","","18","1","0","1.270","89","63","0","6","6","0","","","","","bc718fed13bb1d6b6da138d5c38c7624","0.762","Sat, 30 Nov 2024 05:42:48 GMT","","","","1.1","https://www.pennilessparenting.com/","2024-11-30 15:21:05"
