"https://thepointmag.com/examined-life/parenting-and-panic-agnes-callard/","https://thepointmag.com/examined-life/parenting-and-panic-agnes-callard/","text/html; charset=UTF-8","200","OK","Indexable","","Parenting and Panic | The Point Magazine","40","369","","0","0","","0","0","","0","","0","","0","Parenting and Panic","19","","0","index, follow, max-image-preview:large, max-snippet:-1, max-video-preview:-1","","","","https://thepointmag.com/examined-life/parenting-and-panic-agnes-callard/","","","","","","","117491","29470","1959","308","6.360","84.081","Easy","10.482","0","2","","7","1","0","1.270","85","52","0","12","9","0","","","","","44be5eb242e2bc5ac5c33e2de0cbd1b6","1.626","","","","","1.1","https://thepointmag.com/examined-life/parenting-and-panic-agnes-callard/","2024-11-30 15:20:34"
"https://www.ccef.org/parenting-difficult-child","https://www.ccef.org/parenting-difficult-child","text/html; charset=utf-8","200","OK","Non-Indexable","Canonicalised","Parenting a Difficult Child - A Blog by Julie Lowe","50","423","Some of the most burdensome moments for a parent are when it is clear to those around you that your child is defiant or difficult.","130","799","","0","0","","0","Parenting a difficult child","27","","0","Subscribe Now","13","","0","","","","","https://www.ccef.org/parenting-difficult-child/","","","","","","","119675","25616","1135","178","6.376","77.898","Fairly Easy","8.755","0","0","","1","1","0","1.270","74","45","0","6","6","0","","","","","e5898aae607c1a75413f922f2910ea4d","1.201","","","","","1.1","https://www.ccef.org/parenting-difficult-child","2024-11-30 15:20:52"
"https://yourparentingmojo.com/","https://yourparentingmojo.com/","text/html; charset=UTF-8","200","OK","Indexable","","Your Parenting Mojo | Jen Lumanlan : Research-based ideas to help kids thrive","77","690","Jen Lumanlan is host & founder of Your Parenting Mojo, named best research-based parenting podcast by LifeHacker. She interviews the'Who's Who' in parenting and child development, using a framework that helps families to apply new ideas that fit with their own values. With 190+ episodes covering everything from how to get your kids to eat more vegetables, Why we shouldn't read the Your X-Year-Old Child books anymore, to various topics at the intersection of race and parenting, Your Parenting Mojo has been downloaded 3+ million times worldwide and has evolved to include workshops, ongoing memberships and more to support parents' needs, and children's learning and development. Jen's popular 10 week Taming Your Triggers workshop (opens in Spring and Autumn) helps parents figure out how to stop being triggered by their child's age appropriate behavior and parent from a place of calm, clarity and confidence. For those looking to bring many of the tools and strategies discussed in the podcast into their own home and families, Jen's Parenting Membership (opens in late Spring) helps parents support their child's development while also making parenting easier. And for those parents looking to support their children's intrinsic love of learning, Jen's Learning Membership (opens in Autumn) helps keep children's intrinsic curiosity and motivation intact. In September of 2023, in partnership with Sasquatch Books & Penguin Random House, Jen launched her first book - Parenting Beyond Power: How to Use Connection & Collaboration to Transform Your Family - And the World - that describes practical tools parents can use to raise children who will change the world tomorrow - while also making family life easier today. The book traces the ways that social forces like White supremacy (including racism), patriarchy, and capitalism have hurt us - and how we will pass those hurts on to our children unless we make a conscious decision to do something differently. The book shows step-by-step how to both understand and meet our children's needs and our own needs so we can all live fulfilled lives - making it easier to get out the door in the morning, while raising children who will see all people's needs as equally important as their own. Research-based ideas to help kids thrive.","2292","14293","","0","0","","0","","0","","0","","0","","0","","","","","","","","","","","","237531","28100","1190","174","6.839","86.359","Easy","2.817","0","0","","0","0","0","0.000","39","21","0","4","4","0","","","","","845fd9d959e11d79caae3123d3e4f955","1.034","Fri, 29 Nov 2024 02:12:44 GMT","","","","1.1","https://yourparentingmojo.com/","2024-11-30 15:20:55"
"https://www.hillaryfrank.com/work/weird-parenting-wins","https://www.hillaryfrank.com/work/weird-parenting-wins","text/html;charset=utf-8","200","OK","Indexable","","Weird Parenting Wins — Hillary Frank","36","325","Unusual yet effective parenting strategies from listeners of the hit 
podcast The Longest Shortest Time.","105","636","","0","0","","0","","0","","0","“You can treat this one like a favorite cookbook – pulling it down off the shelf for consultation in moments of need. … It’s a laugh-out-loud parenting companion filled with tiny victories. Want your kid to go hiking? Toss ‘em a tube of lipstick and let ‘em keep applying it as long as they keep walking. Want your 2-year-old to eat peas? Load them into a PEZ dispenser!”","371","“Parenting is a psychological dance, one of the most complicated psychological dances anybody does. How many steps do you know? How quickly can you turn and dance in another direction? Those are good things to know about yourself and I personally feel—that as a general rule—it is better to have more moves than fewer. Most parents are incredibly busy, so Weird Parenting Wins is full of fast hacks. Highly entertaining but also soothing to know that you are not alone in your incompetence. Truly a delight.”","508","","","","","https://www.hillaryfrank.com/work/weird-parenting-wins","","","","","","","196843","30570","461","75","6.147","71.953","Fairly Easy","1.692","0","1","","1","1","0","1.270","27","11","0","17","5","0","","","","","56f48b7bff0f2d9c596ff9dbc20deb25","0.859","","","","","1.1","https://www.hillaryfrank.com/work/weird-parenting-wins","2024-11-30 15:20:23"
"https://medlineplus.gov/parenting.html","https://medlineplus.gov/parenting.html","text/html","200","OK","Indexable","","Parenting: MedlinePlus","22","205","Parenting styles differ from person to person. However, one thing you should always be aware of is your child's safety. Find more parenting tips.","145","891","","0","0","","0","Parenting","9","","0","Summary","7","Start Here","10","","","","","https://medlineplus.gov/parenting.html","","","","","","","91069","11196","884","182","4.857","55.386","Fairly Hard","6.635","0","0","","11","1","0","1.270","52","29","0","62","55","0","","","","","b5ca5b257bce892949a4eb45b444330c","0.811","Sat, 30 Nov 2024 05:25:55 GMT","","","","1.1","https://medlineplus.gov/parenting.html","2024-11-30 15:20:57"
"https://www.columbiacountyga.gov/280/Parenting-Seminar-Page","https://www.columbiacountyga.gov/280/Parenting-Seminar-Page","text/html; charset=utf-8","200","OK","Indexable","","Parenting Seminar Page | Columbia County, GA","44","416","Georgia Law authorizes each judicial circuit to require that litigants who are participating in child custody litigation attend a parenting seminar that has been approved by the judges of that particular circuit.","212","1263","","0","0","","0","Parenting Seminar Page","22","","0","","0","","0","","","","","","","","","","","","84459","24560","195","43","4.535","59.063","Fairly Hard","2.660","0","1","","6","1","0","1.270","62","41","0","6","6","0","","","","","f5d1cab2414bc586e647c1a5f15cc72f","1.426","","","","","1.1","https://www.columbiacountyga.gov/280/Parenting-Seminar-Page","2024-11-30 15:20:44"
"https://theparentingcenter.org/","https://theparentingcenter.org/","text/html; charset=UTF-8","200","OK","Indexable","","Home - The Parenting Center","27","257","","0","0","","0","0","","0","Life can be challenging. We are here to help.","45","PROGRAMS DESIGNED WITH YOUFAMILIESCHILDRENCOUPLESYOUTH IN MIND.","63","EVERYONE DESERVES","17","EVERYONE DESERVES","17","max-image-preview:large","","","","https://theparentingcenter.org/","https://theparentingcenter.org/","","","","","","119821","21368","240","54","4.444","84.236","Easy","1.563","0","0","","10","1","0","1.270","51","20","0","6","5","0","","","","","fabc3c4ddf22d65302427095285465b4","1.476","","","","","1.1","https://theparentingcenter.org/","2024-11-30 15:20:40"
"https://www.ndcourts.gov/legal-resources/rules/ndrct/8-6","https://www.ndcourts.gov/legal-resources/rules/ndrct/8-6","","0","Connection Timeout","Non-Indexable","No Response","","0","0","","0","0","","0","0","","0","","0","","0","","0","","0","","","","","","","","","","","","0","0","0","","","","","0.000","0","3","","0","0","0","0.000","0","0","0","0","0","0","","","","","","","","","","","","https://www.ndcourts.gov/legal-resources/rules/ndrct/8-6","2024-11-30 15:20:19"
"https://www.parentingwholeheartedly.com/","https://www.parentingwholeheartedly.com/","text/html; charset=utf-8","200","OK","Indexable","","Parenting Wholeheartedly","24","229","Parenting coach for strong-willed kids, raising strong-willed kids with more patience, use Positive Discipline, and parent get on the same page. ( parenting class Omaha)","169","1037","","0","0","","0","","0","","0","Danielle Bettmann","17","Become the Calm, Confident Parent your Strong-Willed Child Needs","64","","","","","https://www.parentingwholeheartedly.com/","","","","","","","84532","17215","1685","236","7.140","80.897","Easy","11.947","0","0","","3","1","0","1.270","14","9","0","2","2","0","","","","","19f07857547f5f8041b0d71883fa828d","2.244","","","","","1.1","https://www.parentingwholeheartedly.com/","2024-11-30 15:21:02"
"https://nymag.com/news/features/67024/","https://nymag.com/news/features/67024/","text/html; charset=utf-8","200","OK","Indexable","","Why Parents Hate Parenting","26","249","“I love my children. I hate my life.” Why does study after study show that having kids makes people less happy?  Inside the misery of the American parent.","154","945","","0","0","","0","All Joy and No Fun","18","","0","Search","6","Search","6","max-image-preview:large","","nocache","","https://nymag.com/news/features/67024/","","","","","","","1472792","386433","5659","854","6.626","76.625","Fairly Easy","2.525","0","3","","3","1","0","1.270","119","74","0","54","27","0","","","","","ca92683d59a49e46043154a40672a593","1.679","","","","","1.1","https://nymag.com/news/features/67024/","2024-11-30 15:20:45"
"https://www.theparentingjunkie.com/","https://www.theparentingjunkie.com/","text/html; charset=UTF-8","200","OK","Indexable","","The Parenting Junkie - The Parenting Junkie","43","392","search bar top section hi,I'm Avital.(pronounced Ah-Vee-Tal) I'm a mindful parenting coach, childhood designer, and mother. My work is dedicated to empowering intentional, imperfect parents (like you and me!) who face chaos, clutter, and conflict, through online tools to reclaim peace","285","1759","","0","0","","0","LOVE PARENTING& parent from Love","32","","0","Get Avital’s New Book!","22","The Parenting Junkie Show","25","index, follow, max-image-preview:large, max-snippet:-1, max-video-preview:-1","","","","https://www.theparentingjunkie.com/","","","","","","","122276","33976","577","115","5.017","75.209","Fairly Easy","4.763","0","0","","7","1","0","1.270","16","8","0","17","12","0","","","","","b13c465497887e8d7ed4efa37bde29b5","2.311","","","","","1.1","https://www.theparentingjunkie.com/","2024-11-30 15:20:44"
"https://www.nccourts.gov/documents/publications/the-most-important-job-parenting-information-for-families-living-apart-north-carolina-parent-education-handbook","https://www.nccourts.gov/documents/publications/the-most-important-job-parenting-information-for-families-living-apart-north-carolina-parent-education-handbook","text/html; charset=UTF-8","200","OK","Indexable","","The Most Important Job: Parenting Information for Families Living Apart (North Carolina Parent Education Handbook) | North Carolina Judicial Branch","147","1320","Companion handbook to the Parent Education video available in English and Spanish.","82","529","","0","0","","0","North Carolina Judicial Branch","30","The Most Important Job: Parenting Information for Families Living Apart (North Carolina Parent Education Handbook)","114","Menu","4","Navigation","10","","","","","https://www.nccourts.gov/documents/publications/the-most-important-job-parenting-information-for-families-living-apart-north-carolina-parent-education-handbook","","","","","","","52825","9087","210","57","3.684","65.318","Normal","5.856","0","2","","10","1","0","1.270","113","74","0","9","9","0","","","","","2756ffcdf36d736e1d90b9b62744c49c","1.516","Sat, 30 Nov 2024 08:58:36 GMT","","","","1.1","https://www.nccourts.gov/documents/publications/the-most-important-job-parenting-information-for-families-living-apart-north-carolina-parent-education-handbook","2024-11-30 15:20:36"
"https://parentingpath.org/","https://parentingpath.org/","text/html; charset=UTF-8","200","OK","Indexable","","Home : The Parenting PATH","25","249","","0","0","","0","0","","0","Our Mission","11","","0","Around Our Community","20","Privacy Policy","14","","","","","","","","","","","","92370","16017","315","65","4.846","77.836","Fairly Easy","13.590","0","0","","11","1","0","1.270","138","53","0","23","10","0","","","","","d4f5878d9366e4fffb34080bac4ee09e","2.263","","","","","1.1","https://parentingpath.org/","2024-11-30 15:20:19"
"https://www.thegospelcoalition.org/blogs/kevin-deyoung/parenting-001/","https://www.thegospelcoalition.org/blogs/kevin-deyoung/parenting-001/","","0","Connection Timeout","Non-Indexable","No Response","","0","0","","0","0","","0","0","","0","","0","","0","","0","","0","","","","","","","","","","","","0","0","0","","","","","0.000","0","3","","0","0","0","0.000","0","0","0","0","0","0","","","","","","","","","","","","https://www.thegospelcoalition.org/blogs/kevin-deyoung/parenting-001/","2024-11-30 15:20:14"
"https://psychcentral.com/health/parenting-strategies-for-behavioral-issues-that-work","https://psychcentral.com/health/parenting-strategies-for-behavioral-issues-that-work","","0","Connection Timeout","Non-Indexable","No Response","","0","0","","0","0","","0","0","","0","","0","","0","","0","","0","","","","","","","","","","","","0","0","0","","","","","0.000","0","1","","0","0","0","0.000","0","0","0","0","0","0","","","","","","","","","","","","https://psychcentral.com/health/parenting-strategies-for-behavioral-issues-that-work","2024-11-30 15:20:59"
"https://www.parents.com/","https://www.parents.com/","text/html;charset=utf-8","200","OK","Indexable","","Parents: Trusted Parenting Information for Raising the Future","61","540","Parents empowers today's families with trustworthy information from experts, empathetic advice, and a supportive community.","123","785","","0","0","","0","","0","","0","Latest News","11","Raising Gen Alpha","17","max-image-preview:large, NOODP, NOYDIR","","","","https://www.parents.com/","","","","","","","180855","38164","587","109","5.385","76.559","Fairly Easy","3.586","0","0","","6","1","0","1.270","161","83","0","23","12","0","","","","","e0ecb582572abb6b62f8853bc7a922ae","0.590","","","","","1.1","https://www.parents.com/","2024-11-30 15:20:18"
"https://www.extension.iastate.edu/humansciences/parenting","https://www.extension.iastate.edu/humansciences/parenting","text/html; charset=UTF-8","200","OK","Indexable","","Parenting | Iowa State University Extension and Outreach Health and Human Sciences","82","757","","0","0","","0","0","","0","Main navigation","15","Parenting","9","Programs","8","Contact Us","10","","","","","https://www.extension.iastate.edu/humansciences/parenting","","","","","","","87477","10373","79","26","3.038","62.394","Normal","1.330","0","1","","5","1","0","1.270","57","38","0","6","6","0","","","","","fe7626579ea0ac0fbd70fb7de35caa07","1.431","Wed, 27 Nov 2024 01:17:37 GMT","","","","1.1","https://www.extension.iastate.edu/humansciences/parenting","2024-11-30 15:20:58"
"https://courts.mt.gov/forms/childcustody","https://courts.mt.gov/forms/childcustody","text/html","200","OK","Indexable","","Child Custody, Parenting Plans, Visitation","42","364","","0","0","","0","0","","0","","0","","0","Child Custody, Parenting Plans, Visitation","42","","0","","","","","","","","","","","","19455","6254","479","97","4.938","60.175","Normal","16.487","0","1","","8","1","0","1.270","46","36","0","9","9","0","","","","","3eed981ef11fce3584e063f2fd51d601","1.797","Wed, 02 Oct 2024 17:43:00 GMT","","","","1.1","https://courts.mt.gov/forms/childcustody","2024-11-30 15:20:22"
"https://www.hrc.org/resources/parenting","https://www.hrc.org/resources/parenting","text/html; charset=UTF-8","200","OK","Indexable","","HRC | Parenting","15","139","More LGBTQ+ people are becoming parents than ever before, but there are still barriers to equal recognition under the law. You can find more helpful…","149","926","","0","0","","0","Parenting Select Topic","22","Choose a Location","17","Cookies in use","14","Browse by Topic","15","all","","all","","https://www.hrc.org/resources/parenting","","","","","","","152598","31050","933","203","4.596","61.986","Normal","6.230","0","1","","4","1","0","1.270","128","111","0","16","8","0","","","","","f61a94754dab9b595160dc53a9736756","2.181","","","","","1.1","https://www.hrc.org/resources/parenting","2024-11-30 15:20:14"
"https://evolutionaryparenting.com/","https://evolutionaryparenting.com/","text/html; charset=UTF-8","200","OK","Indexable","","Evolutionary Parenting | Where History Meets Science in Parenting","65","585","Evolutionary Parenting provides parents with information on parenting topics, including co-sleeping, breastfeeding, baby carrying, play, mommy guilt and more.","158","981","","0","0","","0","","0","","0","Latest Articles","15","What is Evolutionary Parenting?","31","max-image-preview:large","","","","https://evolutionaryparenting.com/","","","","","","","178166","56135","615","127","4.843","63.534","Normal","2.523","0","0","","4","1","0","1.270","78","39","0","7","7","0","","","","","92f5c64a0286c6b3b548ddcde2266e","3.135","","","","","1.1","https://evolutionaryparenting.com/","2024-11-30 15:20:51"
"https://www.theguardian.com/lifeandstyle/2024/oct/13/the-thing-about-parenting-is-that-it-is-basically-financially-ruinous","https://www.theguardian.com/lifeandstyle/2024/oct/13/the-thing-about-parenting-is-that-it-is-basically-financially-ruinous","text/html; charset=UTF-8","200","OK","Indexable","","The thing about parenting is that it is, basically, financially ruinous | Family | The Guardian","95","783","Tip: take a leaf from Kemi Badenoch’s book and marry a banker","61","390","","0","0","","0","The thing about parenting is that it is, basically, financially ruinous","71","","0","Most viewed","11","Most viewed","11","max-image-preview:large","","","","https://www.theguardian.com/lifeandstyle/2024/oct/13/the-thing-about-parenting-is-that-it-is-basically-financially-ruinous","","","","","","","293379","48752","715","105","6.810","78.170","Fairly Easy","2.066","0","4","","5","1","0","1.270","138","89","0","11","9","0","","","","","375ac1deb0d13ca02dd0d72f4fe80b61","0.529","","","","","1.1","https://www.theguardian.com/lifeandstyle/2024/oct/13/the-thing-about-parenting-is-that-it-is-basically-financially-ruinous","2024-11-30 15:20:42"
"https://www.courts.wa.gov/forms/?fa=forms.contribute&formID=145","https://www.courts.wa.gov/forms/?fa=forms.contribute&formID=145","","0","Connection Timeout","Non-Indexable","No Response","","0","0","","0","0","","0","0","","0","","0","","0","","0","","0","","","","","","","","","","","","0","0","0","","","","","0.000","0","1","","0","0","0","0.000","0","0","0","0","0","0","","","","","","","","","","","","https://www.courts.wa.gov/forms/?fa=forms.contribute&formID=145","2024-11-30 15:20:58"
"https://www.nytimes.com/section/parenting","https://www.nytimes.com/section/parenting","text/html; charset=utf-8","200","OK","Indexable","","Parenting - The New York Times","30","283","Parenting","9","60","Parenting","9","60","Parenting","9","Parenting","9","","0","Highlights","10","Latest","6","","","","","https://www.nytimes.com/section/parenting","","","","","","","802769","117503","761","154","4.942","69.639","Normal","0.635","0","1","","10","1","0","1.270","62","53","0","3","3","0","","","","","722b616106f8938467b0622ac9b0cf09","0.580","Sat, 30 Nov 2024 10:12:56 GMT","","","","1.1","https://www.nytimes.com/section/parenting","2024-11-30 15:20:18"
"https://www.utcourts.gov/en/self-help/case-categories/family/parenting-plans.html","https://www.utcourts.gov/en/self-help/case-categories/family/parenting-plans.html","text/html;charset=utf-8","200","OK","Indexable","","Parenting Plans","15","140","","0","0","","0","0","","0","Parenting Plans","15","","0","","0","","0","","","","","https://www.utcourts.gov/en/self-help/case-categories/family/parenting-plans.html","","","","","","","113869","16155","924","126","7.333","68.463","Normal","8.397","0","4","","3","1","0","1.270","149","125","0","18","12","0","","","","","a41997a876eeb39b5f62771cf96c929b","1.513","Sat, 30 Nov 2024 09:52:01 GMT","","","","1.1","https://www.utcourts.gov/en/self-help/case-categories/family/parenting-plans.html","2024-11-30 15:20:51"
"https://www.parenting.org/","https://www.parenting.org/","","0","Connection Timeout","Non-Indexable","No Response","","0","0","","0","0","","0","0","","0","","0","","0","","0","","0","","","","","","","","","","","","0","0","0","","","","","0.000","0","0","","0","0","0","0.000","0","0","0","0","0","0","","","","","","","","","","","","https://www.parenting.org/","2024-11-30 15:20:58"
"https://www.veterantraining.va.gov/parenting/","https://www.veterantraining.va.gov/parenting/","text/html","200","OK","Indexable","","Parenting for Veterans - Veteran Training","41","361","This free online course provides parents with tools that strengthen parenting skills and helps them reconnect with their children.","130","795","Apply for and manage the VA benefits and services you’ve earned as a Veteran, Servicemember, or family member—like health care, disability, education, and more.","160","1003","Veteran parents, military parents, parenting after service, military parenting, military parenting skills, Veteran parenting, parenting for Veterans, Veteran parenting skills, milfam resources","192","Veteran Training","16","","0","Parenting for Veterans","22","Parenting Skills Made Easier","28","","","","","","","","","","","","79841","79841","1042","267","3.903","76.136","Fairly Easy","9.325","0","1","","24","1","0","1.270","269","207","0","25","15","0","","","","","5f1130164a2d93cb35514cde0759eb59","1.656","","","","","1.1","https://www.veterantraining.va.gov/parenting/","2024-11-30 15:20:18"
"https://www.brownhealth.org/centers-services/parenting-matters","https://www.brownhealth.org/centers-services/parenting-matters","text/html; charset=UTF-8","200","OK","Indexable","","Parenting Matters | Brown University Health","43","385","Bradley Hospital, the nation’s first psychiatric hospital for children, presents Parenting Matters.","99","586","","0","0","","0","Parenting Matters","17","","0","Parenting Matters Spring Conference","35","Parenting Matters Spring Conference","35","","","","","https://www.brownhealth.org/centers-services/parenting-matters","","","","","","","95128","20399","191","37","5.162","49.227","Hard","6.196","0","1","","5","1","0","1.270","134","69","0","6","6","0","","","","","e4fa8e47bd30cd2025a6a2da485d7a6a","1.823","Fri, 29 Nov 2024 23:50:43 GMT","","","","1.1","https://www.brownhealth.org/centers-services/parenting-matters","2024-11-30 15:20:58"
"https://www.parentingfairly.com/","https://www.parentingfairly.com/","text/html;charset=utf-8","200","OK","Indexable","","Parenting Fairly","16","138","","0","0","","0","0","","0","","0","","0","Providing real-life solutions to parent with calm and confidence.","65","","0","","","","","https://www.parentingfairly.com/","","","","","","","127703","21617","305","54","5.648","73.509","Fairly Easy","1.777","0","0","","3","1","0","1.270","34","11","0","11","8","0","","","","","9446da60af7afe9eb3a0497721982317","1.134","","","","","1.1","https://www.parentingfairly.com/","2024-11-30 15:20:19"
"https://archive.legmt.gov/bills/mca/title_0400/chapter_0040/part_0020/section_0340/0400-0040-0020-0340.html","https://archive.legmt.gov/bills/mca/title_0400/chapter_0040/part_0020/section_0340/0400-0040-0020-0340.html","text/html; charset=UTF-8","200","OK","Indexable","","40-4-234. Final parenting plan criteria, MCA","44","382","","0","0","","0","0","","0","Montana Code Annotated 2023","27","Final Parenting Plan Criteria","29","Part 2. Support, Custody, Visitation, and Related Provisions","60","","0","","","","","","","","","","","","11645","11645","807","112","7.205","64.287","Normal","44.783","0","6","","0","0","0","0.000","10","7","0","2","2","0","","","","","3007730309af0f72a0ff0af5aaf60bdc","1.462","Wed, 11 Sep 2024 19:10:19 GMT","","","","1.1","https://archive.legmt.gov/bills/mca/title_0400/chapter_0040/part_0020/section_0340/0400-0040-0020-0340.html","2024-11-30 15:20:40"
