"Original Url","Address","Content Type","Status Code","Status","Indexability","Indexability Status","Title 1","Title 1 Length","Title 1 Pixel Width","Meta Description 1","Meta Description 1 Length","Meta Description 1 Pixel Width","Meta Description 2","Meta Description 2 Length","Meta Description 2 Pixel Width","Meta Keywords 1","Meta Keywords 1 Length","H1-1","H1-1 Length","H1-2","H1-2 Length","H2-1","H2-1 Length","H2-2","H2-2 Length","Meta Robots 1","Meta Robots 2","X-Robots-Tag 1","Meta Refresh 1","Canonical Link Element 1","Canonical Link Element 2","rel=""next"" 1","rel=""prev"" 1","HTTP rel=""next"" 1","HTTP rel=""prev"" 1","amphtml Link Element","Size (bytes)","Transferred (bytes)","Word Count","Sentence Count","Average Words Per Sentence","Flesch Reading Ease Score","Readability","Text Ratio","Crawl Depth","Folder Depth","Link Score","Inlinks","Unique Inlinks","Unique JS Inlinks","% of Total","Outlinks","Unique Outlinks","Unique JS Outlinks","External Outlinks","Unique External Outlinks","Unique External JS Outlinks","Closest Similarity Match","No. Near Duplicates","Spelling Errors","Grammar Errors","Hash","Response Time","Last Modified","Redirect URL","Redirect Type","Cookies","HTTP Version","URL Encoded Address","Crawl Timestamp"
"https://www.tiktok.com/tag/parenting?lang=en","https://www.tiktok.com/tag/parenting?lang=en","text/html","200","OK","Indexable","","","0","0","","0","0","","0","0","","0","","0","","0","","0","","0","","","","","","","","","","","","9918","1651","0","","","","","0.000","0","1","","0","0","0","0.000","0","0","0","0","0","0","","","","","1ccaa0bd8a1a5f3f6c57300b8c8a7f15","0.271","","","","","1.1","https://www.tiktok.com/tag/parenting?lang=en","2024-11-30 15:20:32"
"https://www.apa.org/topics/parenting","https://www.apa.org/topics/parenting","text/html; charset=utf-8","200","OK","Indexable","","Parenting","9","86","The job of parenting aims to ensure children’s health and safety, prepare children for life as productive adults, transmit cultural values, and more.","149","893","","0","0","parenting advice, children, parenting skills, peer pressure, family relations, single parents, daycare, day care, discipline, spanking, temper tantrums, teenagers, working moms, Children, Parenting, Teens,","205","Parenting","9","","0","Topics in Psychology","20","Publications and Databases","26","","","","","https://www.apa.org/topics/parenting","","","","","","","119419","21111","398","99","4.020","45.033","Hard","6.463","0","1","","9","1","0","1.270","169","137","0","15","13","0","","","","","d4ce4d54c8757fee4615a28dded50dad","3.976","","","","","1.1","https://www.apa.org/topics/parenting","2024-11-30 15:20:14"
"https://atparentingcommunity.com/","https://atparentingcommunity.com/","text/html; charset=UTF-8","200","OK","Indexable","","AT Parenting Community","22","223","The AT Parenting Community is a members-only site dedicated to parents raising kids with anxiety or OCD.","104","661","","0","0","child anxiety, child ocd, ocd child, child with anxiety, kid with anxiety, kids with anxiety, childhood anxiety, parenting child with anxiety","141","RAISING A CHILD WITH ANXIETY OR OCD CAN BE A LONELY & FRUSTRATED EXPERIENCE...","78","RAISING A CHILD WITH ANXIETY OR OCD?","36","We have all been there.","23","","0","","","","","","","","","","","","258646","43730","1076","160","6.725","87.262","Easy","2.234","0","0","","7","1","0","1.270","8","2","0","10","9","0","","","","","2ab77a0acd26412dc5100f5a25de358c","2.061","","","","","1.1","https://atparentingcommunity.com/","2024-11-30 15:20:30"
"https://eclkc.ohs.acf.hhs.gov/parenting","https://eclkc.ohs.acf.hhs.gov/parenting","text/html; charset=UTF-8","200","OK","Indexable","","Parenting | ECLKC","17","161","Use the resources on this page to increase your knowledge about parenting programs that are most likely to be effective with families of young children in the settings where you work. Find tips and strategies for how to implement these programs well.","250","1553","","0","0","","0","Parenting","9","Parenting","9","Breadcrumb","10","Leading Online Parent Meetings and Groups","41","","","","","https://eclkc.ohs.acf.hhs.gov/parenting","","","","","","","43774","10121","364","79","4.608","60.151","Normal","8.645","0","0","","4","1","0","1.270","105","88","0","9","9","0","","","","","bbe4312f190be5f8f5c30e712e9eb48c","1.060","Wed, 27 Nov 2024 00:43:37 GMT","","","","1.1","https://eclkc.ohs.acf.hhs.gov/parenting","2024-11-30 15:20:51"
"https://codes.ohio.gov/ohio-revised-code/section-5101.804","https://codes.ohio.gov/ohio-revised-code/section-5101.804","","0","Connection Timeout","Non-Indexable","No Response","","0","0","","0","0","","0","0","","0","","0","","0","","0","","0","","","","","","","","","","","","0","0","0","","","","","0.000","0","1","","0","0","0","0.000","0","0","0","0","0","0","","","","","","","","","","","","https://codes.ohio.gov/ohio-revised-code/section-5101.804","2024-11-30 15:20:29"
"https://www.courts.oregon.gov/programs/family/children/pages/parenting-plans.aspx","https://www.courts.oregon.gov/programs/family/children/pages/parenting-plans.aspx","text/html; charset=utf-8","200","OK","Indexable","","Oregon Judicial Department : Parenting Plans : Children & Families : State of Oregon","84","741","","0","0","","0","0","","0","Parenting Plans","15","","0","Footer","6","","0","","","","","https://www.courts.oregon.gov/programs/family/children/pages/parenting-plans.aspx","","","","","","","77296","77296","669","106","6.311","71.190","Fairly Easy","9.138","0","4","","12","1","0","1.270","133","107","0","8","8","0","","","","","2fb62653b65814a003d6f371d32f02e8","2.192","Sat, 30 Nov 2024 10:20:40 GMT","","","","1.1","https://www.courts.oregon.gov/programs/family/children/pages/parenting-plans.aspx","2024-11-30 15:20:39"
"https://positiveparentingconnection.net/","https://positiveparentingconnection.net/","text/html; charset=UTF-8","200","OK","Indexable","","Positive Parenting Connection","29","269","Positive Parenting Connection by Ariadne Brill. Parenting courses, blog and behavior solutions for families with children 0 to 12 years.","136","826","","0","0","","0","Follow Us","9","","0","","0","","0","index, follow, max-image-preview:large, max-snippet:-1, max-video-preview:-1","","","","https://positiveparentingconnection.net/","","","","","","","91527","31856","719","107","6.720","69.408","Normal","5.250","0","0","","2","1","0","1.270","54","34","0","20","20","0","","","","","6e483f3336b9d5e33f6e111ac514a06a","1.394","","","","","1.1","https://positiveparentingconnection.net/","2024-11-30 15:20:45"
"https://pubmed.ncbi.nlm.nih.gov/12553416/","https://pubmed.ncbi.nlm.nih.gov/12553416/","text/html; charset=iso-8859-1","302","Found","Non-Indexable","Redirected","","0","0","","0","0","","0","0","","0","","0","","0","","0","","0","","","","","","","","","","","","233","233","0","","","","","0.000","0","1","","0","0","0","0.000","0","0","0","0","0","0","","","","","","0.332","","https://misuse.ncbi.nlm.nih.gov/error/abuse.shtml","HTTP Redirect","","1.1","https://pubmed.ncbi.nlm.nih.gov/12553416/","2024-11-30 15:20:14"
"https://stopparentingalone.com/","https://stopparentingalone.com/","text/html;charset=utf-8","200","OK","Indexable","","Stop Parenting Alone","20","188","When you understand development, parenting gets easier. You don't need to 
be a perfect parent. You just need to know what to do based on your child's 
development, personality and environment. We can help.","208","1298","","0","0","","0","Stop Parenting Alone","20","Here's How I Can Help","21","Free Parenting Tips","19","","0","","","","","https://stopparentingalone.com/","","","","","","","70398","16752","467","85","5.494","84.594","Easy","4.942","0","0","","4","1","0","1.270","30","15","0","5","5","0","","","","","946c7b1a0218e3a3c43aae26bfb4230a","0.888","","","","","1.1","https://stopparentingalone.com/","2024-11-30 15:21:00"
"https://slate.com/tag/parenting","https://slate.com/tag/parenting","text/html; charset=utf-8","200","OK","Indexable","","Parenting","9","86","All stories about Parenting","27","165","","0","0","","0","Recently in Parenting","21","","0","","0","","0","max-image-preview:large","","","","https://slate.com/tag/parenting","","","","","","","275766","68053","464","123","3.772","90.875","Very Easy","1.281","0","1","","1","1","0","1.270","70","52","0","8","8","0","","","","","d85bac02e9df20be17d2be0825cd2a69","0.687","","","","","1.1","https://slate.com/tag/parenting","2024-11-30 15:20:49"
"https://open.spotify.com/show/27jy3YpTRlpmEuroVZqtTy","https://open.spotify.com/show/27jy3YpTRlpmEuroVZqtTy","text/html; charset=utf-8","403","Forbidden","Non-Indexable","Client Error","","0","0","","0","0","","0","0","","0","","0","","0","","0","","0","","","","","","","","","","","","0","0","0","","","","","0.000","0","1","","0","0","0","0.000","0","0","0","0","0","0","","","","","","0.463","","","","","1.1","https://open.spotify.com/show/27jy3YpTRlpmEuroVZqtTy","2024-11-30 15:20:25"
"https://www.militaryonesource.mil/parenting/","https://www.militaryonesource.mil/parenting/","text/html","403","Forbidden","Non-Indexable","Client Error","","0","0","","0","0","","0","0","","0","","0","","0","","0","","0","","","","","","","","","","","","118","118","0","","","","","0.000","0","1","","0","0","0","0.000","0","0","0","0","0","0","","","","","","1.063","","","","","1.1","https://www.militaryonesource.mil/parenting/","2024-11-30 15:21:04"
"https://brenebrown.com/articles/2019/08/07/what-toni-morrison-taught-me-about-parenting/","https://brenebrown.com/articles/2019/08/07/what-toni-morrison-taught-me-about-parenting/","text/html; charset=UTF-8","200","OK","Indexable","","What Toni Morrison Taught Me About Parenting - Brené Brown","58","553","Toni Morrison’s words are so heavy with truth that one sentence can bring you to your knees or set you free. Her writing challenged me, taught me, and nurtured me. And, Toni Morrison changed the way I’m raising my children.","223","1394","","0","0","","0","What Toni Morrison Taught Me About Parenting","44","What Toni Morrison Taught Me About Parenting","44","Stay connected with what’s new","30","Modal Gallery","13","index, follow, max-image-preview:large, max-snippet:-1, max-video-preview:-1","","","","https://brenebrown.com/articles/2019/08/07/what-toni-morrison-taught-me-about-parenting/","","","","","","","206044","35614","642","104","6.173","91.591","Very Easy","3.342","0","5","","11","1","0","1.270","139","51","0","7","7","0","","","","","ed4c3db00e7590a8cc0bde2d2e2b3ba3","1.142","Sat, 30 Nov 2024 04:28:21 GMT","","","","1.1","https://brenebrown.com/articles/2019/08/07/what-toni-morrison-taught-me-about-parenting/","2024-11-30 15:20:27"
"https://www.ccac.edu/cost-and-aid/parenting-scholars-program.php","https://www.ccac.edu/cost-and-aid/parenting-scholars-program.php","text/html; charset=UTF-8","200","OK","Indexable","","Parenting Scholars Program","26","249","Program may be a great opportunity for you. The Parenting Scholars program provides personal, academic, financial and familial support to students. Participants will receive wrap-around support and guidance from CCAC and the Pittsburgh Scholar House.","250","1582","","0","0","","0","Parenting Scholars Program","26","","0","Menu","4","Academics","9","","","","","https://www.ccac.edu/cost-and-aid/parenting-scholars-program.php","","","","","","","85406","14476","1157","177","6.537","66.098","Normal","13.220","0","1","","12","1","0","1.270","214","137","0","15","11","0","","","","","a3bdd60b87864b84121d2335f49e793b","1.429","","","","","1.1","https://www.ccac.edu/cost-and-aid/parenting-scholars-program.php","2024-11-30 15:20:27"
"https://parentingdecolonized.com/","https://parentingdecolonized.com/","text/html; charset=UTF-8","200","OK","Indexable","","Parenting Decolonized | Life-lessons and reflections on the act of decolonizing parenting as an act or resistance.","114","990","","0","0","","0","0","","0","Get my FREE Intentional Parenting Checklist -->","47","Albert Camus","12","Episode 60: Rethinking Genealogy & Releasing Ancestral Shame with Walter English","80","Episode 59: Decolonizing Food & Reclaiming Gardening with Princess Cole","71","max-image-preview:large","","","","https://parentingdecolonized.com/","","","","","","","404734","74345","643","105","6.124","58.918","Fairly Hard","1.086","0","0","","1","1","0","1.270","35","15","0","7","7","0","","","","","648170b0a8c054e48cf80129f87bc1c9","1.260","","","","","1.1","https://parentingdecolonized.com/","2024-11-30 15:20:52"
"https://www.blinn.edu/parenting-services/index.html","https://www.blinn.edu/parenting-services/index.html","text/html","200","OK","Indexable","","Parenting Services | Blinn College","34","296","Parenting Services mission is to offer meaningful support to pregnant and parenting students by addressing their unique challenges, therefore allowing them...","158","983","","0","0","Parenting Services","18","Parenting Services","18","","0","Mission Statement","17","General Information","19","","","","","https://www.blinn.edu/parenting-services/index.html","","","","","","","77840","77840","717","109","6.578","61.046","Normal","10.195","0","1","","3","1","0","1.270","138","101","0","18","18","0","","","","","29f197536f6711c25f1fbd830962dab","1.347","Tue, 26 Nov 2024 17:47:21 GMT","","","","1.1","https://www.blinn.edu/parenting-services/index.html","2024-11-30 15:20:47"
"https://www.texasattorneygeneral.gov/child-support/programs-and-initiatives/parenting-and-paternity-awareness","https://www.texasattorneygeneral.gov/child-support/programs-and-initiatives/parenting-and-paternity-awareness","text/html; charset=UTF-8","200","OK","Indexable","","Parenting and Paternity Awareness | Office of the Attorney General","66","588","We proactively educate youth on the rights, responsibilities, and realities of parenting through the PAPA program.Parenting and Paternity Awareness (PAPA) is an evidence-based, educational curriculum designed for young adults. It teaches them the benefits of waiting to become a parent until after they have completed their education, started a career, and are in a stable, committed relationship.The PAPA program is a way school districts can comply with state law requiring high-school health to include a parenting and paternity awareness curriculum.","553","3431","","0","0","","0","Parenting and Paternity Awareness","33","","0","Breadcrumb","10","We proactively educate youth on the rights, responsibilities, and realities of parenting through the PAPA program.","114","","","","","https://www.texasattorneygeneral.gov/child-support/programs-and-initiatives/parenting-and-paternity-awareness","","","","","","","127489","42288","447","96","4.656","58.081","Fairly Hard","8.754","0","2","","7","1","0","1.270","75","48","0","15","14","0","","","","","fb53c951fd208a13b2a0e6c54176d952","1.762","Wed, 27 Nov 2024 13:30:10 GMT","","","","1.1","https://www.texasattorneygeneral.gov/child-support/programs-and-initiatives/parenting-and-paternity-awareness","2024-11-30 15:20:24"
"https://www.amazon.com/Parenting-Gospel-Principles-Radically-Change/dp/1433551934","https://www.amazon.com/Parenting-Gospel-Principles-Radically-Change/dp/1433551934","text/html;charset=UTF-8","200","OK","Indexable","","Parenting: 14 Gospel Principles That Can Radically Change Your Family: Tripp, Paul David: 9781433551932: Amazon.com: Books","122","1134","Parenting: 14 Gospel Principles That Can Radically Change Your Family [Tripp, Paul David] on Amazon.com. *FREE* shipping on qualifying offers. Parenting: 14 Gospel Principles That Can Radically Change Your Family","212","1342","","0","0","","0","Follow the author","17","Parenting: 14 Gospel Principles That Can Radically Change Your Family Hardcover – September 30, 2016","100","Frequently bought together","26","More items to explore","21","","","","","","","","","","","","1198216","252967","5812","1302","4.464","82.377","Easy","2.942","0","2","","37","1","0","1.270","273","189","0","23","23","0","","","","","b28aa8156ad73a5e2c015ec06ea2ba2c","0.655","","","","","1.1","https://www.amazon.com/Parenting-Gospel-Principles-Radically-Change/dp/1433551934","2024-11-30 15:20:53"
"https://www.britannica.com/topic/parenting","https://www.britannica.com/topic/parenting","text/html;charset=UTF-8","200","OK","Indexable","","Parenting | Bonding, Discipline & Education | Britannica","56","484","Parenting, the process of raising children and providing them with protection and care in order to ensure their healthy development into adulthood. The long-standing assumption that parents assert a direct and powerful influence on their children through the process of socialization has permeated","297","1842","","0","0","parenting, encyclopedia, encyclopeadia, britannica, article","59","parenting","9","","0","Significance","12","Parenting and child development","31","","","","","https://www.britannica.com/topic/parenting","","","","","","","76503","19663","1585","279","5.681","54.447","Fairly Hard","13.824","0","1","","5","1","0","1.270","117","81","0","19","19","0","","","","","450dc2f889fd1409bcbc9a33ac941a16","0.581","","","","","1.1","https://www.britannica.com/topic/parenting","2024-11-30 15:20:24"
"https://www.flcourts.gov/Resources-Services/Office-of-Family-Courts/Family-Court-in-Florida/Family-Law-Forms/Parenting-Plan-12.995-Forms-A-C","https://www.flcourts.gov/Resources-Services/Office-of-Family-Courts/Family-Court-in-Florida/Family-Law-Forms/Parenting-Plan-12.995-Forms-A-C","text/html; charset=UTF-8","200","OK","Indexable","","Parenting Plan | 12.995 Forms A - C - Florida Courts","52","453","","0","0","","0","0","","0","Parenting Plan | 12.995 Forms A - C","35","","0","12.995(a)","9","12.995(c)","9","","","","","","","","","","","","93514","93514","861","264","3.261","95.245","Very Easy","6.017","0","4","","4","1","0","1.270","176","114","0","12","7","0","","","","","9ed2324aa5a24ca0b8ce36501e705de0","2.667","","","","","1.1","https://www.flcourts.gov/Resources-Services/Office-of-Family-Courts/Family-Court-in-Florida/Family-Law-Forms/Parenting-Plan-12.995-Forms-A-C","2024-11-30 15:20:58"
"https://www.youtube.com/@foster.parenting","https://www.youtube.com/@foster.parenting","text/html; charset=utf-8","200","OK","Non-Indexable","Canonicalised","Laura - Foster Parent Partner - YouTube","39","349","Practical support for becoming a foster parent, trauma-informed parenting, and navigating foster care situations, providing confidence to get started.","150","919","","0","0","Fostercare fosterparent ""foster care"" ""foster parent"" ""foster parenting"" fosterchild ""foster child"" ""foster kid"" ""trauma informed"" ""trauma informed care"" cps...","160","","0","","0","","0","","0","","","","","https://www.youtube.com/channel/UC68WpVnhtE0otLSmWW7JOeA","","","","","","","835620","181192","32","3","10.667","100.000","Very Easy","0.019","0","0","","0","0","0","0.000","13","12","0","1","1","0","","","","","fa4d98ae15d6fd9a2e4058754a6aca05","0.428","","","","","1.1","https://www.youtube.com/@foster.parenting","2024-11-30 15:20:17"
"https://www.tandfonline.com/toc/hpar20/current","https://www.tandfonline.com/toc/hpar20/current","text/html; charset=UTF-8","403","Forbidden","Non-Indexable","Client Error","","0","0","","0","0","","0","0","","0","","0","","0","","0","","0","","","","","","","","","","","","0","0","0","","","","","0.000","0","2","","0","0","0","0.000","0","0","0","0","0","0","","","","","","0.127","","","","","1.1","https://www.tandfonline.com/toc/hpar20/current","2024-11-30 15:20:17"
"https://screamfree.com/","https://screamfree.com/","text/html; charset=UTF-8","200","OK","Indexable","","screamfree | Peace Begins with Pause","36","338","","0","0","This week I go to my son's college orientation, in preparation for launching him from the nest in a month or so. It is a bittersweet time, but...","145","861","college freshman,hal runkel,launching adults,leadership,parenting,raising adults,screamfree,apologize,forgive,happiness,peace,relationships,behavior,communication,compulsive,compulsive behavior,excuses,marriage,tiger woods,control reactions,emotions,feelings,managing emotions,reactions,responses,self-control,ask myself,grow up,growing up,parents,questions,questions to live by,bishop tutu,enemy,face conflict,forgiving,reconciling,truth,change,change oneself,change the world,self-improvement,circumstances,feeling,losing your cool,losing your head,relating,relational skills,think,thinking,appreciate,appreciation,feel appreciated,harmony,relationship,thankful,thanks","670","","0","","0","Thought of the Day","18","This is parenting.","18","max-image-preview:large","","","","https://screamfree.com/","","https://screamfree.com/page/2/","","","","","95388","23442","2684","414","6.483","86.562","Easy","23.842","0","0","","1","1","0","1.270","4","4","0","14","8","0","","","","","f95a64bd629977f217f7ba7906d67ab","1.214","","","","","1.1","https://screamfree.com/","2024-11-30 15:20:56"
"https://en.wikipedia.org/wiki/Parenting","https://en.wikipedia.org/wiki/Parenting","text/html; charset=UTF-8","200","OK","Indexable","","Parenting - Wikipedia","21","187","","0","0","","0","0","","0","Parenting","9","","0","Contents","8","Factors that affect decisions","29","max-image-preview:standard","","","","https://en.wikipedia.org/wiki/Parenting","","","","","","","419265","82359","11401","3009","3.789","58.892","Fairly Hard","18.934","0","1","","318","1","0","1.270","1352","768","0","275","242","0","","","","","567fa19a5ea6853162ff14dd294fab0a","0.834","Sat, 30 Nov 2024 07:02:30 GMT","","","","1.1","https://en.wikipedia.org/wiki/Parenting","2024-11-30 15:20:43"
"https://monadelahooke.com/brain-body-parenting/","https://monadelahooke.com/brain-body-parenting/","text/html; charset=UTF-8","200","OK","Indexable","","Brain-Body Parenting - Mona Delahooke, Ph.D. - Pediatric Psychologist - California","82","719","","0","0","","0","0","","0","Brain-Body Parenting: How to Stop Managing Behavior and Start Raising Joyful, Resilient Kids","92","Brain-Body Parenting","20","How to Stop Managing Behavior and Start Raising Joyful, Resilient Kids","70","Order your copy of Brain-Body Parenting by visiting the retailers below","71","nofollow, max-snippet:-1, max-image-preview:large, max-video-preview:-1","","","","https://monadelahooke.com/brain-body-parenting/","","","","","","","77031","19700","1273","206","6.180","53.227","Fairly Hard","11.577","0","1","","1","1","0","1.270","27","18","0","10","9","0","","","","","82ba901c5be52a9382219cf5c43a19c3","1.272","","","","","1.1","https://monadelahooke.com/brain-body-parenting/","2024-11-30 15:20:52"
"https://www.reddit.com/r/Parenting/","https://www.reddit.com/r/Parenting/","text/html; charset=utf-8","302","Found","Non-Indexable","Redirected","","0","0","","0","0","","0","0","","0","","0","","0","","0","","0","","","","","","","","","","","","406","406","0","","","","","0.000","0","2","","0","0","0","0.000","0","0","0","0","0","0","","","","","","0.469","","https://www.reddit.com/r/Parenting/?rdt=37303","HTTP Redirect","","1.1","https://www.reddit.com/r/Parenting/","2024-11-30 15:20:55"
"https://www.playtherapyparenting.com/","https://www.playtherapyparenting.com/","text/html; charset=UTF-8","200","OK","Indexable","","Play Therapy Parenting® Podcast - The path to calm, confident, and in-control parenting starts now","98","874","Dr. Brenna Hicks, The Kid Counselor®, teaches fundamental parenting skills and theory from a play therapy perspective.","118","742","","0","0","","0","Play Therapy Parenting Podcast","30","","0","Listen to the Latest Episode","28","Latest Podcast Episodes","23","index, follow, max-image-preview:large, max-snippet:-1, max-video-preview:-1","","","","https://www.playtherapyparenting.com/","","","","","","","221150","34270","707","118","5.992","62.306","Normal","2.119","0","0","","2","1","0","1.270","33","14","0","3","3","0","","","","","a7397264fb7d87d0a011b9229ac9be44","1.472","","","","","1.1","https://www.playtherapyparenting.com/","2024-11-30 15:20:37"
"https://www.unioncountync.gov/government/departments-a-e/community-support-outreach/parenting-support","https://www.unioncountync.gov/government/departments-a-e/community-support-outreach/parenting-support","","0","DNS lookup failed","Non-Indexable","No Response","","0","0","","0","0","","0","0","","0","","0","","0","","0","","0","","","","","","","","","","","","0","0","0","","","","","0.000","0","3","","0","0","0","0.000","0","0","0","0","0","0","","","","","","","","","","","","https://www.unioncountync.gov/government/departments-a-e/community-support-outreach/parenting-support","2024-11-30 15:20:47"
"https://www.chnola.org/services/the-parenting-center/","https://www.chnola.org/services/the-parenting-center/","text/html; charset=utf-8","200","OK","Indexable","","The Parenting Center | Children's Hospital New Orleans","54","485","The Parenting Center. Children’s Hospital New Orleans is the first and largest full-service hospital exclusively for children in Louisiana and the Gulf South.","158","946","","0","0","","0","","0","","0","Featured Services","17","Helping Parents Grow","20","","","","","https://www.chnola.org/services/the-parenting-center/","","","","","","","59478","20723","345","84","4.107","76.134","Fairly Easy","9.635","0","2","","1","1","0","1.270","90","73","0","20","17","0","","","","","d2905b2f77a8682fef366447243b7b04","2.436","","","","","1.1","https://www.chnola.org/services/the-parenting-center/","2024-11-30 15:20:55"
