"https://proactiveparenting.net/","https://proactiveparenting.net/","text/html; charset=UTF-8","200","OK","Indexable","","Proactive Parenting: transforms responding into learning moments.","65","595","Proactive Parenting change responding into learning moments. Ways to change yelling & punishment into effective ways to correct behavior, teach self-discipline.","160","1001","","0","0","","0","Transforming your parenting journey from reactive to proactive and responsive so that you raise the next generation of trail-blazers.","133","Proactive Parenting change responding into learning moments. Ways to change yelling & punishment into effective ways to correct behavior, teach self-discipline.","160","~ You want to know why you’re not as calm as you’d like when correcting behavior.","81","~ You use the right words and seem calm on the outside, but lack the tools to correct behavior in a way that allows you feel calm on the inside.","144","follow, index, max-snippet:-1, max-video-preview:-1, max-image-preview:large","","","","https://proactiveparenting.net/","","","","","","","362051","67340","732","101","7.248","74.659","Fairly Easy","1.392","0","0","","3","1","0","1.270","32","21","0","9","3","0","","","","","1e878c021be998278080c430ff3e7211","1.148","Sat, 30 Nov 2024 02:40:07 GMT","","","","1.1","https://proactiveparenting.net/","2024-11-30 15:20:43"
"https://www.mass.gov/early-intervention-parenting-partnerships-eipp","https://www.mass.gov/early-intervention-parenting-partnerships-eipp","text/html; charset=UTF-8","200","OK","Indexable","","Early Intervention Parenting Partnerships (EIPP) | Mass.gov","59","522","A home visiting program offering a unique opportunity, through a team approach, to engage with and support families during pregnancy, continuing through the child’s first birthday.","180","1117","","0","0","","0","Early Intervention Parenting Partnerships (EIPP)","48","","0","Social","6","What would you like to do?","26","","","","","https://www.mass.gov/early-intervention-parenting-partnerships-eipp","","","","","","","163102","41647","528","106","4.981","58.376","Fairly Hard","4.119","0","0","","2","1","0","1.270","71","55","0","7","5","0","","","","","782ab7061c0004ec312c12c031a7efb","2.211","Sat, 30 Nov 2024 10:21:01 GMT","","","","1.1","https://www.mass.gov/early-intervention-parenting-partnerships-eipp","2024-11-30 15:21:01"
"https://selfhelp.courts.ca.gov/resources-develop-parenting-plan","https://selfhelp.courts.ca.gov/resources-develop-parenting-plan","text/html; charset=UTF-8","200","OK","Indexable","","Resources to develop a parenting plan | California Courts | Self Help Guide","75","650","Parenting plans These guides include information about what you and your child's other parent might consider when making a plan. These are just guides, your schedule will reflect your child's and family's needs. Parenting plans at different ages from Superior Court of Los Angeles","280","1737","","0","0","","0","Resources to develop a parenting plan","37","","0","Parenting plans","15","Concerns about your child's safety","34","","","","","https://selfhelp.courts.ca.gov/resources-develop-parenting-plan","","","","","","","144053","48351","872","123","7.089","67.403","Normal","5.231","0","0","","1","1","0","1.270","49","48","0","11","11","0","","","","","4f646cc4f3fbfe95a17e25a302f4587","1.093","Sat, 30 Nov 2024 09:45:47 GMT","","","","1.1","https://selfhelp.courts.ca.gov/resources-develop-parenting-plan","2024-11-30 15:20:53"
"https://www.clarkcountynv.gov/residents/family_services/parenting_classes.php","https://www.clarkcountynv.gov/residents/family_services/parenting_classes.php","text/html","403","Forbidden","Non-Indexable","Client Error","","0","0","","0","0","","0","0","","0","","0","","0","","0","","0","","","","","","","","","","","","118","118","0","","","","","0.000","0","2","","0","0","0","0.000","0","0","0","0","0","0","","","","","","1.210","","","","","1.1","https://www.clarkcountynv.gov/residents/family_services/parenting_classes.php","2024-11-30 15:20:50"
"https://www.fairfaxcounty.gov/familyservices/children-youth/parenting-education-programs","https://www.fairfaxcounty.gov/familyservices/children-youth/parenting-education-programs","text/html; charset=UTF-8","200","OK","Indexable","","Parenting Education Programs | Family Services","46","423","Fairfax County, Virginia - Fairfax County's FREE Parenting Education Program offers parenting classes, articles, videos, and other supportive services to teach positive and effective ways parents can interact with their children at every age and stage of development.","267","1629","","0","0","Parenting Education Programs, PEP, free parenting classes, parenting education, tips, resources, court mandated, support for parents, building stronger families, African American, 0-4 age range, 5-11 age range, adolescents 12-18 age range, Parenting 101 videos, virtual classes, virtual parent cafés, Educación para padres, parents","331","Language Selection","18","Department of Family Services – Children, Youth and Families","60","FFX Global Navigation","21","Department Resources","20","","","","","https://www.fairfaxcounty.gov/familyservices/children-youth/parenting-education-programs","","","","","","","132268","33506","1936","371","5.218","65.112","Normal","13.607","0","2","","20","1","0","1.270","289","195","0","30","25","0","","","","","bfa37a4e091f92b467a15faf4c6f8a3","1.758","Sat, 30 Nov 2024 10:20:41 GMT","","","","1.1","https://www.fairfaxcounty.gov/familyservices/children-youth/parenting-education-programs","2024-11-30 15:20:42"
"https://www.kansasjudicialcouncil.org/legal-forms/divorce/divorce-minor-children/filing-petition-divorce/parenting-plan","https://www.kansasjudicialcouncil.org/legal-forms/divorce/divorce-minor-children/filing-petition-divorce/parenting-plan","text/html; charset=utf-8","200","OK","Indexable","","Parenting Plan | Kansas Judicial Council","40","355","","0","0","","0","0","","0","Kansas Judicial Council Improving the administration of justice","63","Parenting Plan","14","Search form","11","You are here","12","","","","","https://www.kansasjudicialcouncil.org/legal-forms/divorce/divorce-minor-children/filing-petition-divorce/parenting-plan","","","","","","","25037","25037","280","61","4.590","71.952","Fairly Easy","13.145","0","4","","4","1","0","1.270","113","60","0","1","1","0","","","","","3420abea18aa982ff0f88385b6bc6c8d","1.645","","","","","1.1","https://www.kansasjudicialcouncil.org/legal-forms/divorce/divorce-minor-children/filing-petition-divorce/parenting-plan","2024-11-30 15:20:21"
"https://dss.sd.gov/childprotection/parentingprogram.aspx","https://dss.sd.gov/childprotection/parentingprogram.aspx","text/html; charset=utf-8","200","OK","Indexable","","Child Protection | Parenting Programs","37","334","South Dakota Department of Social Services","42","273","","0","0","south dakota department of social services, social services, sd dss, dss, snap, tanf, medicaid, behavioral health, economic assistance, licensing, child care, child protection, child safety","189","Parenting Programs","18","","0","Common Sense Parenting","22","Positive Indian Parenting","25","","","","","","","","","","","","23720","23720","328","66","4.970","51.161","Fairly Hard","16.040","0","1","","2","1","0","1.270","116","81","0","10","10","0","","","","","9327b3399a55169b4d4ccfed0bbf2cab","1.322","","","","","1.1","https://dss.sd.gov/childprotection/parentingprogram.aspx","2024-11-30 15:20:14"
"https://parentingtranslator.org/","https://parentingtranslator.org/","text/html;charset=utf-8","200","OK","Indexable","","Parenting Translator","20","181","Dr. Cara Goodwin, PhD, is a mother of three children and a licensed child 
psychologist who ""translates"" scientific parenting research into 
information that is useful, accurate, and relevant for parents.","206","1219","","0","0","","0","Welcome!","8","","0","New on the Blog","15","Translating Scientific Research into Lingo Parents Can Understand and Use","73","","","","","https://parentingtranslator.org/","","","","","","","145519","23969","253","50","5.060","84.664","Easy","1.547","0","0","","5","1","0","1.270","45","16","0","15","7","0","","","","","6ca52837902f61d61af731ae7bdc20f0","1.234","","","","","1.1","https://parentingtranslator.org/","2024-11-30 15:20:15"
"https://www.instagram.com/responsive_parenting/?hl=en","https://www.instagram.com/responsive_parenting/?hl=en","text/html; charset=""utf-8""","200","OK","Non-Indexable","Canonicalised","Jessica Milburn (@responsive_parenting) • Instagram photos and videos","69","640","528K Followers, 4,267 Following, 7,649 Posts - Jessica Milburn (@responsive_parenting) on Instagram: ""J. Milburn
Mom of ❤️❤️❤️
Degree in Child Development (BCD & ECE)
Author | CPTSD Survivor | ND Home | Child Rights Advocate
Books & Workshops 👇""","246","1559","","0","0","","0","","0","","0","","0","","0","noarchive, noimageindex","","","","https://www.instagram.com/responsive_parenting/","","","","","","","558840","117887","0","","","","","0.000","0","1","","0","0","0","0.000","0","0","0","0","0","0","","","","","deb0aba8a8d4ce0296c372d51b2c0bf3","1.882","","","","","1.1","https://www.instagram.com/responsive_parenting/?hl=en","2024-11-30 15:20:32"
"https://www.webmd.com/parenting/default.htm","https://www.webmd.com/parenting/default.htm","text/html","200","OK","Indexable","","Parenting Center: Parenting Tips and Advice from WebMD","54","513","Here you'll find parenting tips and informative information including expert parenting advice for each age and stage in your child's development.","145","887","","0","0","","0","Find Doctors and Dentists Near You","34","","0","","0","1 of 5 / Toddler Milestones","27","","","","","https://www.webmd.com/parenting/default.htm","","","","","","","411702","69647","861","158","5.449","83.689","Easy","1.488","0","1","","3","1","0","1.270","154","132","0","3","3","0","","","","","f938043949e847e2817d6ca1b0299162","0.458","","","","","1.1","https://www.webmd.com/parenting/default.htm","2024-11-30 15:20:28"
